Cites,Authors,Title,Year,Source,Publisher,ArticleURL,CitesURL,GSRank,QueryDate,Type,DOI,ISSN,CitationURL,Volume,Issue,StartPage,EndPage,ECC,CitesPerYear,CitesPerAuthor,AuthorCount,Age,Abstract,FullTextURL,RelatedURL
2561,"R Paul, L Elder",The miniature guide to critical thinking concepts and tools,2019,,books.google.com,https://books.google.com/books?hl=en&lr=&id=Cm6pDwAAQBAJ&oi=fnd&pg=PA4&dq=critical+theory%7Ccritical+theory&ots=Yd0EdhxmXK&sig=8E1DfeXVmaZGOL8Q-rlmOf12vrU,https://scholar.google.com/scholar?cites=15300112377321400081&as_sdt=2005&sciodt=2007&hl=en,255,1/31/2024 10:28,BOOK,,,,,,,,2561,512.2,1281,2,5,"… This book offers additional critical thinking theory and … internalize the basic tools of critical thinking and apply them within … We use concepts, ideas, and theories to interpret data, facts, …",,https://scholar.google.com/scholar?q=related:EafMySTrVNQJ:scholar.google.com/&scioq=critical+theory%7Ccritical+theory&hl=en&as_sdt=2007&as_ylo=1998&as_yhi=2023
3294,SG Harding,The feminist standpoint theory reader: Intellectual and political controversies,2004,,books.google.com,https://books.google.com/books?hl=en&lr=&id=qmSySHvIy5IC&oi=fnd&pg=PR9&dq=critical+theory%7Ccritical+theory&ots=q0K0r98Kik&sig=8ZsYcY3GgtKbBvLTJJWPASw25z8,https://scholar.google.com/scholar?cites=7472301663127749607&as_sdt=2005&sciodt=2007&hl=en,256,1/31/2024 10:28,BOOK,,,,,,,,3294,164.7,3294,1,20,"… theory, now recognized as Standpoint Theory, which caused heated debate and radically altered the way research is conducted. The Feminist Standpoint Theory … of Standpoint Theory, …",,https://scholar.google.com/scholar?q=related:50NKzcXysmcJ:scholar.google.com/&scioq=critical+theory%7Ccritical+theory&hl=en&as_sdt=2007&as_ylo=1998&as_yhi=2023
12199,J Butler,Performative acts and gender constitution: An essay in phenomenology and feminist theory,2020,Feminist theory reader,taylorfrancis.com,https://www.taylorfrancis.com/chapters/edit/10.4324/9781003001201-42/performative-acts-gender-constitution-judith-butler,https://scholar.google.com/scholar?cites=13791795633870261064&as_sdt=2005&sciodt=2007&hl=en,257,1/31/2024 10:28,,10.4324/9781003001201-42,,,,,,,12199,3049.75,12199,1,4,"… reified as natural over time has received a good deal of critical attention not only from Michel … These theories, however, still lack the critical resources for thinking radically about the …",https://web.stanford.edu/~eckert/Courses/l1562018/Readings/Butler1988.pdf,https://scholar.google.com/scholar?q=related:SMuekw5NZr8J:scholar.google.com/&scioq=critical+theory%7Ccritical+theory&hl=en&as_sdt=2007&as_ylo=1998&as_yhi=2023
37172,"NK Denzin, YS Lincoln",The Sage handbook of qualitative research,2011,,books.google.com,https://books.google.com/books?hl=en&lr=&id=AIRpMHgBYqIC&oi=fnd&pg=PP1&dq=critical+theory%7Ccritical+theory&ots=kqzQDDdCic&sig=FrrnxnXqVosW0BhvpULSVDCg7gU,https://scholar.google.com/scholar?cites=15161120334080098559&as_sdt=2005&sciodt=2007&hl=en,258,1/31/2024 10:28,BOOK,,,,,,,,37172,2859.38,18586,2,13,"… tivist, critical theory, feminist, queer, and critical race theory, as … , theories of critical pedagogy, performance [auto] ethnographies; standpoint epistemologies, critical race theory; critical, …",,https://scholar.google.com/scholar?q=related:_8DL5Z0eZ9IJ:scholar.google.com/&scioq=critical+theory%7Ccritical+theory&hl=en&as_sdt=2007&as_ylo=1998&as_yhi=2023
4460,"J Adams, MM Aggarwal, Z Ahammed, J Amonett…",Experimental and theoretical challenges in the search for the quark–gluon plasma: The STAR Collaboration's critical assessment of the evidence from RHIC collisions,2005,Nuclear Physics A,Elsevier,https://www.sciencedirect.com/science/article/pii/S0375947405005294,https://scholar.google.com/scholar?cites=17064761305398447245&as_sdt=2005&sciodt=2007&hl=en,259,1/31/2024 10:28,,,,,,,,,4460,234.74,892,5,19,"… Are the theories and … and theory, on important crosschecks and quantifications, on predictions not yet borne out by experiment and experimental results not yet accommodated by theory. …",https://arxiv.org/pdf/nucl-ex/0501009,https://scholar.google.com/scholar?q=related:jQwbif410uwJ:scholar.google.com/&scioq=critical+theory%7Ccritical+theory&hl=en&as_sdt=2007&as_ylo=1998&as_yhi=2023
2710,R Eckersley,Environmentalism and political theory: Toward an ecocentric approach,2023,,taylorfrancis.com,https://www.taylorfrancis.com/books/mono/10.4324/9781315072111/environmentalism-political-theory-robyn-eckersley,https://scholar.google.com/scholar?cites=3510483349234489553&as_sdt=2005&sciodt=2007&hl=en,260,1/31/2024 10:28,BOOK,10.4324/9781315072111,,,,,,,2710,2710,2710,1,1,"… political theories and, through a dialogue with these theories, … as an adequate ecocentric political theory. In the concluding … ecocentric political theory that has emerged from the critical …",,https://scholar.google.com/scholar?q=related:0ZgLvQG-tzAJ:scholar.google.com/&scioq=critical+theory%7Ccritical+theory&hl=en&as_sdt=2007&as_ylo=1998&as_yhi=2023
176,A Thacker,Critical literary geography,2017,The Routledge Handbook of Literature and Space,taylorfrancis.com,https://www.taylorfrancis.com/chapters/edit/10.4324/9781315745978-3/critical-literary-geography-andrew-thacker,https://scholar.google.com/scholar?cites=1131715534482455053&as_sdt=2005&sciodt=2007&hl=en,261,1/31/2024 10:28,,10.4324/9781315745978-3,,,,,,,176,25.14,176,1,7,… can learn from geography and spatial theory. There are many similarities between a literary geography as understood by proponents of spatial theory and that of the approach proposed …,,https://scholar.google.com/scholar?q=related:DTqeU0iptA8J:scholar.google.com/&scioq=critical+theory%7Ccritical+theory&hl=en&as_sdt=2007&as_ylo=1998&as_yhi=2023
5666,DP Britzman,Practice makes practice: A critical study of learning to teach,2012,,books.google.com,https://books.google.com/books?hl=en&lr=&id=axEE_EYg1RoC&oi=fnd&pg=PR3&dq=critical+theory%7Ccritical+theory&ots=IC_LHcablo&sig=3xJIalJABQvs-svhekF26Pe451c,https://scholar.google.com/scholar?cites=863994424425972172&as_sdt=2005&sciodt=2007&hl=en,262,1/31/2024 10:28,BOOK,,,,,,,,5666,472.17,5666,1,12,"… called throughout this study, “theory.” And yet this view that theory can and should matter to … Theories of poststructuralism renewed important discussions on the nature of our knowledge…",https://www.academia.edu/download/85288121/6b793226f629c664eeb138b2560023fbe45e.pdf,https://scholar.google.com/scholar?q=related:zAHU81mG_QsJ:scholar.google.com/&scioq=critical+theory%7Ccritical+theory&hl=en&as_sdt=2007&as_ylo=1998&as_yhi=2023
120,LD Berg,Scaling knowledge: towards a critical geography of critical geographies,2004,Geoforum,Elsevier,https://www.sciencedirect.com/science/article/pii/S0016718504000181,https://scholar.google.com/scholar?cites=7888505546300612144&as_sdt=2005&sciodt=2007&hl=en,263,1/31/2024 10:28,,,,,,,,,120,6,120,1,20,"… critical geographers need to take geography seriously, by using their own critical geographical theories … spatialities arising from the production of theory in Anglo-American geography. …",https://www.academia.edu/download/29561056/GF2004.pdf,https://scholar.google.com/scholar?q=related:MF7yz_-ZeW0J:scholar.google.com/&scioq=critical+theory%7Ccritical+theory&hl=en&as_sdt=2007&as_ylo=1998&as_yhi=2023
141,"J Rowlands, S Rawolle",Neoliberalism is not a theory of everything: a Bourdieuian analysis of illusio in educational research,2013,Critical studies in education,Taylor &Francis,https://www.tandfonline.com/doi/abs/10.1080/17508487.2013.830631,https://scholar.google.com/scholar?cites=13806450577932239623&as_sdt=2005&sciodt=2007&hl=en,264,1/31/2024 10:28,,10.1080/17508487.2013.830631,,,,,,,141,12.82,71,2,11,… neoliberalism and the ways in which his theories have been used by researchers to analyse … We have drawn on Bourdieu’s theories in this article not only because of his intense interest …,https://www.researchgate.net/profile/Shaun-Rawolle/publication/256423416_Neoliberalism_is_not_a_theory_of_everything_a_Bourdieuian_analysis_of_illusio_in_educational_research/links/55d3daa508ae0a3417226e76/Neoliberalism-is-not-a-theory-of-everything-a-Bourdieuian-analysis-of-illusio-in-educational-research,https://scholar.google.com/scholar?q=related:B0OjoqZdmr8J:scholar.google.com/&scioq=critical+theory%7Ccritical+theory&hl=en&as_sdt=2007&as_ylo=1998&as_yhi=2023
105,"M Ylönen, H Kuusela",Consultocracy and its discontents: A critical typology and a call for a research agenda,2019,Governance,Wiley Online Library,https://onlinelibrary.wiley.com/doi/abs/10.1111/gove.12369,https://scholar.google.com/scholar?cites=11167285854776698379&as_sdt=2005&sciodt=2007&hl=en,265,1/31/2024 10:28,,10.1111/gove.12369,,,,,,,105,21,53,2,5,"… Following the principles of grounded theory, theory development was advanced during each step of data collection and the identification of specific cases on which to focus. Thus, the …",https://onlinelibrary.wiley.com/doi/pdfdirect/10.1111/gove.12369,https://scholar.google.com/scholar?q=related:C6Y1b1Er-poJ:scholar.google.com/&scioq=critical+theory%7Ccritical+theory&hl=en&as_sdt=2007&as_ylo=1998&as_yhi=2023
2169,Y Engestrom,Activity theory as a framework for analyzing and redesigning work,2000,Ergonomics,Taylor &Francis,https://www.tandfonline.com/doi/abs/10.1080/001401300409143,https://scholar.google.com/scholar?cites=1449090485124137092&as_sdt=2005&sciodt=2007&hl=en,266,1/31/2024 10:28,,10.1080/001401300409143,,,,,,,2169,90.38,2169,1,24,"… While hybrid concepts such as those mentioned above are fruitful, they are not theories in … Hospital head physician: We have these task force groups for the critical pathways in place, …",https://paginas.fe.up.pt/~deg08007/artigosPesquisaTese/Artigos%20Activity%20Theory/22_AT%20as%20a%20framework_for_analyzing_and_redesigning_work.PDF,https://scholar.google.com/scholar?q=related:hAA5XR40HBQJ:scholar.google.com/&scioq=critical+theory%7Ccritical+theory&hl=en&as_sdt=2007&as_ylo=1998&as_yhi=2023
168,S Van Dyk,The appraisal of difference: Critical gerontology and the active-ageing-paradigm,2014,Journal of aging studies,Elsevier,https://www.sciencedirect.com/science/article/pii/S0890406514000504,https://scholar.google.com/scholar?cites=13854970801315320319&as_sdt=2005&sciodt=2007&hl=en,267,1/31/2024 10:28,,,,,,,,,168,16.8,168,1,10,"… At the same time, influences from Critical Theory, Cultural … choice of conceptual delineations and theories carries the (sometimes … line between activity theory and disengagement theory, …",,https://scholar.google.com/scholar?q=related:_xHPeYm-RsAJ:scholar.google.com/&scioq=critical+theory%7Ccritical+theory&hl=en&as_sdt=2007&as_ylo=1998&as_yhi=2023
2697,IA Richards,Principles of literary criticism,2017,,taylorfrancis.com,https://www.taylorfrancis.com/books/mono/10.4324/9781351223508/principles-literary-criticism-richards,https://scholar.google.com/scholar?cites=3843884888089397682&as_sdt=2005&sciodt=2007&hl=en,268,1/31/2024 10:28,BOOK,10.4324/9781351223508,,,,,,,2697,385.29,2697,1,7,"… Mr Richards begins with an account of the present chaos of critical theories and follows with … Such are the pinnacles, the apices of critical theory, the heights gained in the past by the …",https://books.google.com/books?hl=en&lr=&id=KisOAAAAIAAJ&oi=fnd&pg=PP19&dq=critical+theory%7Ccritical+theory&ots=9Z4dY0Olbd&sig=7J-t_rsJ-niUogjkwh95B884_R4,https://scholar.google.com/scholar?q=related:sokPoPA4WDUJ:scholar.google.com/&scioq=critical+theory%7Ccritical+theory&hl=en&as_sdt=2007&as_ylo=1998&as_yhi=2023
2988,HA Giroux,On critical pedagogy,2020,,torrossa.com,https://www.torrossa.com/it/resources/an/5210445,https://scholar.google.com/scholar?cites=14084120008086924833&as_sdt=2005&sciodt=2007&hl=en,269,1/31/2024 10:28,,,,,,,,,2988,747,2988,1,4,"… Contrary to these ideas, I develop a theory of critical pedagogy that provides a range of … stance while concomitantly reconstructing new educational theories and practices, classroom …",https://www.academia.edu/download/34091726/bizzel_1991.pdf,https://scholar.google.com/scholar?q=related:IS7-x4bYdMMJ:scholar.google.com/&scioq=critical+theory%7Ccritical+theory&hl=en&as_sdt=2007&as_ylo=1998&as_yhi=2023
4177,P Chilton,Analysing political discourse: Theory and practice,2004,,taylorfrancis.com,https://www.taylorfrancis.com/books/mono/10.4324/9780203561218/analysing-political-discourse-paul-chilton,https://scholar.google.com/scholar?cites=4845568350241221831&as_sdt=2005&sciodt=2007&hl=en,270,1/31/2024 10:28,BOOK,10.4324/9780203561218,,,,,,,4177,208.85,4177,1,20,"… Rhetoric, generative linguistics, critical theory, cognitive linguistics – all these contexts are reflected in the present book, but most of all the last two. The book has come about through a …",https://voidnetwork.gr/wp-content/uploads/2016/10/Analysing-political-discourse-Theory-and-Practice-by-Paul-Chilton.pdf,https://scholar.google.com/scholar?q=related:x-wA273qPkMJ:scholar.google.com/&scioq=critical+theory%7Ccritical+theory&hl=en&as_sdt=2007&as_ylo=1998&as_yhi=2023
158,YLR Wong,Knowing through discomfort: A mindfulness-based critical social work pedagogy,2004,Critical Social Work,ojs.uwindsor.ca,https://ojs.uwindsor.ca/index.php/csw/article/download/5636/4606?inline=,https://scholar.google.com/scholar?cites=10349933290334946261&as_sdt=2005&sciodt=2007&hl=en,271,1/31/2024 10:28,HTML,,,,,,,,158,7.9,158,1,20,… Colin Piele (1998) argues that missing in critical theories of change is the importance of … between what we think and how we act goes beyond a simple theory-practice split” (p.3). It has …,https://ojs.uwindsor.ca/index.php/csw/article/download/5636/4606?inline=,https://scholar.google.com/scholar?q=related:1YNnw31Zoo8J:scholar.google.com/&scioq=critical+theory%7Ccritical+theory&hl=en&as_sdt=2007&as_ylo=1998&as_yhi=2023
3952,J Storey,Cultural theory and popular culture: An introduction,2021,,taylorfrancis.com,https://www.taylorfrancis.com/books/mono/10.4324/9781003011729/cultural-theory-popular-culture-john-storey,https://scholar.google.com/scholar?cites=17020689627113908970&as_sdt=2005&sciodt=2007&hl=en,272,1/31/2024 10:28,BOOK,10.4324/9781003011729,,,,,,,3952,1317.33,3952,1,3,"… a clear and critical survey of competing theories of, and … update some of the theories and methodologies discussed in … of the encounter between cultural theory and popular culture. …",,https://scholar.google.com/scholar?q=related:6upMUAmjNewJ:scholar.google.com/&scioq=critical+theory%7Ccritical+theory&hl=en&as_sdt=2007&as_ylo=1998&as_yhi=2023
142,"LJ Santamaría, AP Santamaría",Counteracting educational injustice with applied critical leadership: Culturally responsive practices promoting sustainable change,2015,International Journal of …,ijme-journal.org,http://ijme-journal.org/ijme/index.php/ijme/article/view/1013,https://scholar.google.com/scholar?cites=11705139725085615919&as_sdt=2005&sciodt=2007&hl=en,273,1/31/2024 10:28,,,,,,,,,142,15.78,71,2,9,"… including transformative leadership, critical pedagogy, and critical race theory (LadsonBillings, 1999; May &Sleeter, 2010; Shields, 2010). In ACL, critical theories function to analyze …",http://ijme-journal.org/ijme/index.php/ijme/article/download/1013/1040,https://scholar.google.com/scholar?q=related:L6cKQJACcaIJ:scholar.google.com/&scioq=critical+theory%7Ccritical+theory&hl=en&as_sdt=2007&as_ylo=1998&as_yhi=2023
140,"A Prasad, I Holzinger",Seeing through smoke and mirrors: A critical analysis of marketing CSR,2013,Journal of Business Research,Elsevier,https://www.sciencedirect.com/science/article/pii/S0148296313000374,https://scholar.google.com/scholar?cites=7112159124368371575&as_sdt=2005&sciodt=2007&hl=en,274,1/31/2024 10:28,,,,,,,,,140,12.73,70,2,11,… Critical management is “a branch of management theory that critiques our intellectual and … While neo-classical theories of the corporation assume that perfect information and …,https://www.researchgate.net/profile/Ajnesh-Prasad/publication/273856732_Seeing_through_smoke_and_mirrors_A_critical_analysis_of_marketing_CSR/links/5da5d53c92851caa1ba605b7/Seeing-through-smoke-and-mirrors-A-critical-analysis-of-marketing-CSR.pdf,https://scholar.google.com/scholar?q=related:d68Hsgp3s2IJ:scholar.google.com/&scioq=critical+theory%7Ccritical+theory&hl=en&as_sdt=2007&as_ylo=1998&as_yhi=2023
2293,R Williams,11 Base and Superstructure in Marxist Cultural Theory,2012,Media and cultural studies: Keyworks,books.google.com,https://books.google.com/books?hl=en&lr=&id=zNqMDwAAQBAJ&oi=fnd&pg=PA115&dq=critical+theory%7Ccritical+theory&ots=SkjwUIxhqW&sig=3fhOurfrYmpnw69zFqR6pbvNcPo,https://scholar.google.com/scholar?cites=2640202525575370423&as_sdt=2005&sciodt=2007&hl=en,275,1/31/2024 10:28,,,,,,,,,2293,191.08,2293,1,12,"… theory, but let us for a moment consider it. What seems to me very striking is that nearly all forms of contemporary critical theory are theories of … of consumption theory was the theory of “…",https://we.riseup.net/assets/102142/appadurai.pdf#page=169,https://scholar.google.com/scholar?q=related:t1YCaDXioyQJ:scholar.google.com/&scioq=critical+theory%7Ccritical+theory&hl=en&as_sdt=2007&as_ylo=1998&as_yhi=2023
3762,JD Culler,The literary in theory,2007,,books.google.com,https://books.google.com/books?hl=en&lr=&id=wmxwT746DucC&oi=fnd&pg=PA1&dq=critical+theory%7Ccritical+theory&ots=wIkC6Z6Jbr&sig=xPN-pIrkiyQL5-QdeKA3f5apJ7M,https://scholar.google.com/scholar?cites=12528480964096111783&as_sdt=2005&sciodt=2007&hl=en,276,1/31/2024 10:28,BOOK,,,,,,,,3762,221.29,3762,1,17,"… within a space articulated by theory, or theories, theoretical discourses, … theory is a live market by preferring to publish introductions to theory or anthologies of theory rather than critical …",https://ff.ues.rs.ba/wp-content/uploads/2018/10/Literary_Theory__A_Very_Short_Introduction__Very_Short_Introductions_.pdf,https://scholar.google.com/scholar?q=related:pzQx4A4b3q0J:scholar.google.com/&scioq=critical+theory%7Ccritical+theory&hl=en&as_sdt=2007&as_ylo=1998&as_yhi=2023
106,TL King,Humans involved: Lurking in the lines of posthumanist flight,2017,Critical Ethnic Studies,JSTOR,https://www.jstor.org/stable/10.5749/jcritethnstud.3.1.0162,https://scholar.google.com/scholar?cites=1181352149402214381&as_sdt=2005&sciodt=2007&hl=en,277,1/31/2024 10:28,,10.5749/jcritethnstud.3.1.0162,,,,,,,106,15.14,106,1,7,"… When decolonial and Black abolitionist thought has to contend with Western or European continental theory, specifically its critical theories of progressive (liberal) social change, one …",,https://scholar.google.com/scholar?q=related:7V_DU4UBZRAJ:scholar.google.com/&scioq=critical+theory%7Ccritical+theory&hl=en&as_sdt=2007&as_ylo=1998&as_yhi=2023
58,C Vaughan,"Dialogue, critical consciousness, and praxis",2011,The social psychology of communication,Springer,https://link.springer.com/chapter/10.1057/9780230297616_3,https://scholar.google.com/scholar?cites=5291054431886166281&as_sdt=2005&sciodt=2007&hl=en,278,1/31/2024 10:28,,10.1057/9780230297616_3,,,,,,,58,4.46,58,1,13,"… and explored through the lenses of critical theory and empirical examples drawn from the … ’ (see Chapter 9); it is also debated by theories of pragmatics (Chapter 5), and evolutionary …",,https://scholar.google.com/scholar?q=related:CcnU-_iZbUkJ:scholar.google.com/&scioq=critical+theory%7Ccritical+theory&hl=en&as_sdt=2007&as_ylo=1998&as_yhi=2023
2727,SB Banerjee,"Corporate social responsibility: The good, the bad and the ugly",2008,Critical sociology,journals.sagepub.com,https://journals.sagepub.com/doi/abs/10.1177/0896920507084623,https://scholar.google.com/scholar?cites=7393990031259540230&as_sdt=2005&sciodt=2007&hl=en,279,1/31/2024 10:28,,10.1177/0896920507084623,,,,,,,2727,170.44,2727,1,16,… theory of the firm represents a form of stakeholder colonialism that serves to regulate the behavior of stakeholders. I conclude by discussing implications for critical management studies. …,https://openaccess.city.ac.uk/id/eprint/6095/8/,https://scholar.google.com/scholar?q=related:BhsBJsK6nGYJ:scholar.google.com/&scioq=critical+theory%7Ccritical+theory&hl=en&as_sdt=2007&as_ylo=1998&as_yhi=2023
5373,JG Ponterotto,Qualitative research in counseling psychology: A primer on research paradigms and philosophy of science.,2005,Journal of counseling psychology,psycnet.apa.org,https://psycnet.apa.org/record/2005-03263-002,https://scholar.google.com/scholar?cites=6799280934865894799&as_sdt=2005&sciodt=2007&hl=en,280,1/31/2024 10:28,,,,,,,,,5373,282.79,5373,1,19,"… in critical theory, a characteristic that is in marked contrast to the positivist and postpositivist paradigms. Feminist, critical race, and queer theory … the rubric of critical theory (see Denzin &…",https://citeseerx.ist.psu.edu/document?repid=rep1&type=pdf&doi=c96d0a8c5ae86c3468829ef60905055d60de7968,https://scholar.google.com/scholar?q=related:j33EcvzlW14J:scholar.google.com/&scioq=critical+theory%7Ccritical+theory&hl=en&as_sdt=2007&as_ylo=1998&as_yhi=2023
145,"YS Fang, YC Ho, TJ Chen",Passive earth pressure with critical state concept,2002,Journal of Geotechnical and …,ascelibrary.org,https://ascelibrary.org/doi/abs/10.1061/(ASCE)1090-0241(2002)128:8(651),https://scholar.google.com/scholar?cites=843399718201920770&as_sdt=2005&sciodt=2007&hl=en,281,1/31/2024 10:28,,10.1061/(ASCE)1090-0241(2002)128:8(651),,,,,,,145,6.59,48,3,22,"… rupture surface had reached the critical state, and the shearing … critical state concept to either Terzaghi or Coulomb theory. … most earth pressure theories, such as Coulomb’s theory, the …",,https://scholar.google.com/scholar?q=related:Ag0XP5NbtAsJ:scholar.google.com/&scioq=critical+theory%7Ccritical+theory&hl=en&as_sdt=2007&as_ylo=1998&as_yhi=2023
34,"B Van Apeldoorn, I Bruff",The richness and diversity of critical IPE perspectives: Moving beyond the debate on the 'British School',2010,International Political Economy,taylorfrancis.com,https://www.taylorfrancis.com/chapters/edit/10.4324/9780203842508-29/richness-diversity-critical-ipe-perspectives-moving-beyond-debate-british-school-bastiaan-van-apeldoorn-ian-bruff,https://scholar.google.com/scholar?cites=6838090273949368660&as_sdt=2005&sciodt=2007&hl=en,282,1/31/2024 10:28,,10.4324/9780203842508-29,,,,,,,34,2.43,17,2,14,"… spawned continental philosophy, critical theory, or for that matter the mercantilist- historical … it enables us to see whether our concepts and theories themselves make sense. It is the latter …",https://www.academia.edu/download/35284439/van_Apeldoorn_et_al__2010_-_Critical_IPE_perspectives_-_IPE_volume.pdf,https://scholar.google.com/scholar?q=related:VEHO2N_G5V4J:scholar.google.com/&scioq=critical+theory%7Ccritical+theory&hl=en&as_sdt=2007&as_ylo=1998&as_yhi=2023
36,"JP Beetz, E Rossi","The EU's democratic deficit in a realist key: multilateral governance, popular sovereignty and critical responsiveness",2017,Transnational Legal Theory,Taylor &Francis,https://www.tandfonline.com/doi/abs/10.1080/20414005.2017.1307316,https://scholar.google.com/scholar?cites=4129890591599104720&as_sdt=2005&sciodt=2007&hl=en,283,1/31/2024 10:28,,10.1080/20414005.2017.1307316,,,,,,,36,5.14,18,2,7,… familiar from many mainstream theories of legitimacy. If it is a … Williams introduces his ‘Critical Theory Principle’ (CTP): ‘the … 18 with a central feature of critical theory as a form of political …,https://www.tandfonline.com/doi/pdf/10.1080/20414005.2017.1307316,https://scholar.google.com/scholar?q=related:0BJ-qZxRUDkJ:scholar.google.com/&scioq=critical+theory%7Ccritical+theory&hl=en&as_sdt=2007&as_ylo=1998&as_yhi=2023
151,S Fuller,Why science studies has never been critical of science: Some recent lessons on how to be a helpful nuisance and a harmless radical,2000,Philosophy of the Social Sciences,journals.sagepub.com,https://journals.sagepub.com/doi/abs/10.1177/004839310003000101,https://scholar.google.com/scholar?cites=2028585140990960229&as_sdt=2005&sciodt=2007&hl=en,284,1/31/2024 10:28,,10.1177/004839310003000101,,,,,,,151,6.29,151,1,24,… I begin by presenting the Parisian position—“actor-network theory”—… theories that scientists and technologists use to explain their activities but also from the more sophisticated theories …,https://samizdathealth.org/wp-content/uploads/2020/12/Fuiller-Philosophy-of-social-sciences.pdf,https://scholar.google.com/scholar?q=related:ZeJmFXD7JhwJ:scholar.google.com/&scioq=critical+theory%7Ccritical+theory&hl=en&as_sdt=2007&as_ylo=1998&as_yhi=2023
8671,"R Wodak, M Meyer",Methods of critical discourse studies,2015,,books.google.com,https://books.google.com/books?hl=en&lr=&id=TseICwAAQBAJ&oi=fnd&pg=PP1&dq=critical+theory%7Ccritical+theory&ots=npeOp1qKNN&sig=ttCI3NSsHPANN6yc5lbFFz6Nmmk,https://scholar.google.com/scholar?cites=14550121857240871701&as_sdt=2005&sciodt=2007&hl=en,285,1/31/2024 10:28,BOOK,,,,,,,,8671,963.44,4336,2,9,"This is a sophisticated and nuanced introduction to critical discourse analysis (CDA) that … rich understanding of the many angles into critical discourse analysis, the fundamentals of how …",https://www.researchgate.net/profile/Thays-Adrian-Segovia/publication/301323849_Book_Review_Methods_of_Critical_Discourse_Analysis/links/5711a37b08aeff315b9f7d31/Book-Review-Methods-of-Critical-Discourse-Analysis.pdf,https://scholar.google.com/scholar?q=related:FTN9Q71q7MkJ:scholar.google.com/&scioq=critical+theory%7Ccritical+theory&hl=en&as_sdt=2007&as_ylo=1998&as_yhi=2023
