Cites,Authors,Title,Year,Source,Publisher,ArticleURL,CitesURL,GSRank,QueryDate,Type,DOI,ISSN,CitationURL,Volume,Issue,StartPage,EndPage,ECC,CitesPerYear,CitesPerAuthor,AuthorCount,Age,Abstract,FullTextURL,RelatedURL
3369,"J Mahoney, K Thelen",A theory of gradual institutional change,2010,Explaining institutional change …,books.google.com,https://books.google.com/books?hl=en&lr=&id=PACmgwrYeRMC&oi=fnd&pg=PA1&dq=critical+theory%7Ccritical+theory&ots=NnSF8Ti9zV&sig=9KuFBARlsJtOAoYu4YgqkjrxoJc,https://scholar.google.com/scholar?cites=15829510730741426725&as_sdt=2005&sciodt=2007&hl=en,503,1/31/2024 10:28,,,,,,,,,3369,240.64,1685,2,14,… We have good theories of why various kinds of basic institutional … And we have theories to explain those crucial moments … Answering these basic questions is a critical next step if …,https://edisciplinas.usp.br/pluginfile.php/6488422/mod_resource/content/1/Mahoney%20e%20Thelen%20-%20Ch.%201%20e%20Ch.%203.pdf,https://scholar.google.com/scholar?q=related:JaoTKiS4rdsJ:scholar.google.com/&scioq=critical+theory%7Ccritical+theory&hl=en&as_sdt=2007&as_ylo=1998&as_yhi=2023
2467,GP Huber,"A theory of the effects of advanced information technologies on organizational design, intelligence, and decision making",2009,"Knowledge, groupware and the Internet",taylorfrancis.com,https://www.taylorfrancis.com/chapters/edit/10.4324/9780080509815-12/theory-effects-advanced-information-technologies-organizational-design-intelligence-decision-making-george-huber,https://scholar.google.com/scholar?cites=5059943753017286537&as_sdt=2005&sciodt=2007&hl=en,504,1/31/2024 10:28,,10.4324/9780080509815-12,,,,,,,2467,164.47,2467,1,15,… This article sets forth a theory of the effects that computer-assisted com munication and … Several components of the theory are controversial and in need of critical empirical investigation. …,https://www.academia.edu/download/3460470/Huber.pdf,https://scholar.google.com/scholar?q=related:iV8N3giIOEYJ:scholar.google.com/&scioq=critical+theory%7Ccritical+theory&hl=en&as_sdt=2007&as_ylo=1998&as_yhi=2023
3059,R Braidotti,Metamorphoses: Towards a materialist theory of becoming,2013,,books.google.com,https://books.google.com/books?hl=en&lr=&id=VZ8RAAAAQBAJ&oi=fnd&pg=PT6&dq=critical+theory%7Ccritical+theory&ots=AWebYgc9u5&sig=4tbX0jWF7JeQeVT7qbTbg1fbeiQ,https://scholar.google.com/scholar?cites=13736242751856604910&as_sdt=2005&sciodt=2007&hl=en,505,1/31/2024 10:28,BOOK,,,,,,,,3059,278.09,3059,1,11,"… , molecular biology, evolutionary theories andthe despoticauthorityof DNAhas caused … relief inthe often foggy bottoms of critical theory. Althoughitis critical in orientation, this bookis …",,https://scholar.google.com/scholar?q=related:7nbyTAHwoL4J:scholar.google.com/&scioq=critical+theory%7Ccritical+theory&hl=en&as_sdt=2007&as_ylo=1998&as_yhi=2023
2653,JE McPeck,Critical thinking and education,2016,,books.google.com,https://books.google.com/books?hl=en&lr=&id=E1IPDQAAQBAJ&oi=fnd&pg=PT8&dq=critical+theory%7Ccritical+theory&ots=89eYv5BSMF&sig=6x2xKOilJxzV1Ojw4unmj83jIYY,https://scholar.google.com/scholar?cites=6527203710054077739&as_sdt=2005&sciodt=2007&hl=en,506,1/31/2024 10:28,BOOK,,,,,,,,2653,331.63,2653,1,8,"… And where expert testimony appears to conflict, perhaps because it is based upon different theories, our quandary worsens. One of the difficulties associated with making such …",,https://scholar.google.com/scholar?q=related:K5ViEjFJlVoJ:scholar.google.com/&scioq=critical+theory%7Ccritical+theory&hl=en&as_sdt=2007&as_ylo=1998&as_yhi=2023
16201,N Rose,Powers of freedom: Reframing political thought,1999,,books.google.com,https://books.google.com/books?hl=en&lr=&id=0UmvRJkREtYC&oi=fnd&pg=PP11&dq=critical+theory%7Ccritical+theory&ots=BbsFN8pYaf&sig=rPpnqWT8-t1-HRoa8FTvJbv8wuE,https://scholar.google.com/scholar?cites=15869280922840272896&as_sdt=2005&sciodt=2007&hl=en,507,1/31/2024 10:28,BOOK,,,,,,,,16201,648.04,16201,1,25,"… experience of supportive, critical and committed intellectual work … Of course, in our millenarian moment, many novel theories of … I do not wish to wrap a general theory of governmentality, …",,https://scholar.google.com/scholar?q=related:ABDHlusCO9wJ:scholar.google.com/&scioq=critical+theory%7Ccritical+theory&hl=en&as_sdt=2007&as_ylo=1998&as_yhi=2023
3231,T Morton,The ecological thought,2010,,books.google.com,https://books.google.com/books?hl=en&lr=&id=MMD3hI6nnnwC&oi=fnd&pg=PP13&dq=critical+theory%7Ccritical+theory&ots=kfQ4apzP06&sig=S0IL_SFavljHEIM2IjLr1Wpa-BA,https://scholar.google.com/scholar?cites=13856266896223118053&as_sdt=2005&sciodt=2007&hl=en,508,1/31/2024 10:28,BOOK,,,,,,,,3231,230.79,3231,1,14,"… deeply informed by critical theory, this book won't be talking very explicitly about theory. Why… philosophy of consciousness, and in particular theories of artificial intelligence. Animals and …",https://www.academia.edu/download/31251137/Watson--Ecological_Thought.pdf,https://scholar.google.com/scholar?q=related:5SJiFlRZS8AJ:scholar.google.com/&scioq=critical+theory%7Ccritical+theory&hl=en&as_sdt=2007&as_ylo=1998&as_yhi=2023
164,"SP Friedman, NA Seaton",Critical path analysis of the relationship between permeability and electrical conductivity of three‐dimensional pore networks,1998,Water Resources Research,Wiley Online Library,https://agupubs.onlinelibrary.wiley.com/doi/abs/10.1029/98WR00939,https://scholar.google.com/scholar?cites=11150290998236164404&as_sdt=2005&sciodt=2007&hl=en,509,1/31/2024 10:28,,10.1029/98WR00939,,,,,,,164,6.31,82,2,26,"… We will not review these theories, but we will only mention the interesting ""dynamically … Pampoukis, Effective medium theory and network theory applied to the transport properties …",https://agupubs.onlinelibrary.wiley.com/doi/pdf/10.1029/98WR00939,https://scholar.google.com/scholar?q=related:NDEaDJbKvZoJ:scholar.google.com/&scioq=critical+theory%7Ccritical+theory&hl=en&as_sdt=2007&as_ylo=1998&as_yhi=2023
3305,"RM Ryan, EL Deci","Intrinsic and extrinsic motivation from a self-determination theory perspective: Definitions, theory, practices, and future directions",2020,Contemporary educational psychology,Elsevier,https://www.sciencedirect.com/science/article/pii/S0361476X20300254,https://scholar.google.com/scholar?cites=5618817214728261277&as_sdt=2005&sciodt=2007&hl=en,510,1/31/2024 10:28,,,,,,,,,3305,826.25,1653,2,4,"… a basis for critical comparisons between teaching … of theory that can be both empirically grounded and critical, and thus merits consideration alongside other critical educational theories. …",https://www.detlevschuller.com/wp-content/uploads/2020/06/2020_RyanDeci_IntrinsicandExtrinsic.pdf,https://scholar.google.com/scholar?q=related:nU66rXwM-k0J:scholar.google.com/&scioq=critical+theory%7Ccritical+theory&hl=en&as_sdt=2007&as_ylo=1998&as_yhi=2023
4791,"A Ardichvili, R Cardozo, S Ray",A theory of entrepreneurial opportunity identification and development,2003,Journal of Business venturing,Elsevier,https://www.sciencedirect.com/science/article/pii/S0883902601000684,https://scholar.google.com/scholar?cites=10139349082641171830&as_sdt=2005&sciodt=2007&hl=en,511,1/31/2024 10:28,,,,,,,,,4791,228.14,1597,3,21,… a comprehensive theory of opportunity identification and development. Such a theory is critical if we want to successfully bridge research and practice: a sound theory provides a means …,http://www.ices.hr/en/wp-content/uploads/2019/01/Ardichvilli-Cardozo-Ray-A-theory-of-entrepreneurial-opportunity-identification-and-development.pdf,https://scholar.google.com/scholar?q=related:doWCJEU0towJ:scholar.google.com/&scioq=critical+theory%7Ccritical+theory&hl=en&as_sdt=2007&as_ylo=1998&as_yhi=2023
2499,"S Davoudi, K Shaw, LJ Haider, AE Quinlan…",Resilience: a bridging concept or a dead end?“Reframing” resilience: challenges for planning theory and practice interacting traps: resilience assessment of a pasture …,2012,Planning theory & …,Taylor &Francis,https://www.tandfonline.com/doi/abs/10.1080/14649357.2012.677124,https://scholar.google.com/scholar?cites=12367784559836973875&as_sdt=2005&sciodt=2007&hl=en,512,1/31/2024 10:28,,10.1080/14649357.2012.677124,,,,,,,2499,208.25,500,5,12,"… critical questions about a resilience approach for planning. … theories that emphasise multiple, contingent and relational dynamics of change including post-structural planning theory (…",https://www.tandfonline.com/doi/full/10.1080/14649357.2012.677124,https://scholar.google.com/scholar?q=related:M8uko4cyo6sJ:scholar.google.com/&scioq=critical+theory%7Ccritical+theory&hl=en&as_sdt=2007&as_ylo=1998&as_yhi=2023
152,"EL Tuthill, JM McGrath, M Graber…",Breastfeeding self-efficacy: a critical review of available instruments,2016,Journal of human …,journals.sagepub.com,https://journals.sagepub.com/doi/abs/10.1177/0890334415599533,https://scholar.google.com/scholar?cites=18126315175160171184&as_sdt=2005&sciodt=2007&hl=en,513,1/31/2024 10:28,,10.1177/0890334415599533,,,,,,,152,19,38,4,8,"… The major difference between the PBSES and IFI scale is the underlying theories. Rather than applying Social Cognitive Theory, the IFI scale is grounded in the Theory of Planned …",https://www.ncbi.nlm.nih.gov/pmc/articles/PMC4882127/,https://scholar.google.com/scholar?q=related:sMoxTp2bjfsJ:scholar.google.com/&scioq=critical+theory%7Ccritical+theory&hl=en&as_sdt=2007&as_ylo=1998&as_yhi=2023
4367,D Hume,An enquiry concerning the principles of morals: a critical edition,1998,,books.google.com,https://books.google.com/books?hl=en&lr=&id=xGFE53T5yd8C&oi=fnd&pg=PA3&dq=critical+theory%7Ccritical+theory&ots=_YOF848WsD&sig=ccfe9zrEtqSsS1t-plze-RjWxmM,https://scholar.google.com/scholar?cites=10635503011404858374&as_sdt=2005&sciodt=2007&hl=en,514,1/31/2024 10:28,BOOK,,,,,,,,4367,167.96,4367,1,26,"… a theory of the foundations of morality and of the nature of personal merit. In doing so, he revisits the theory … present volume is the first in a new critical edition of his works, the Clarendon …",https://epub.us/wp-content/books/an-enquiry-concerning-the-principles-of-morals-by-david-hume.pdf,https://scholar.google.com/scholar?q=related:BkRiuqPlmJMJ:scholar.google.com/&scioq=critical+theory%7Ccritical+theory&hl=en&as_sdt=2007&as_ylo=1998&as_yhi=2023
5970,EM Griffin,A first look at communication theory,2006,,psycnet.apa.org,https://psycnet.apa.org/record/2005-12493-000,https://scholar.google.com/scholar?cites=15094257749346137728&as_sdt=2005&sciodt=2007&hl=en,515,1/31/2024 10:28,BOOK,,,,,,,,5970,331.67,5970,1,18,… specific theories in a way that makes them both interesting and understandable. Each theory … These communication context sections usually contain two or three theories. Each section …,,https://scholar.google.com/scholar?q=related:gLb2QXOTedEJ:scholar.google.com/&scioq=critical+theory%7Ccritical+theory&hl=en&as_sdt=2007&as_ylo=1998&as_yhi=2023
2976,E Fradkin,Field theories of condensed matter physics,2013,,books.google.com,https://books.google.com/books?hl=en&lr=&id=x7_6MX4ye_wC&oi=fnd&pg=PR11&dq=critical+theory%7Ccritical+theory&ots=OWLzTm2YpQ&sig=Wt7n5PAZxwpkC_AfFShfTW70CgQ,https://scholar.google.com/scholar?cites=5046545062963676072&as_sdt=2005&sciodt=2007&hl=en,516,1/31/2024 10:28,BOOK,,,,,,,,2976,270.55,2976,1,11,"… the strengths of this ﬁeld: critical phenomena and the quantum … theory before critical phenomena became recognized as a ﬁeld, its importance to the complete structure of the ﬁeld theory …",http://lib.ysu.am/open_books/417239.pdf,https://scholar.google.com/scholar?q=related:qIPzPP_tCEYJ:scholar.google.com/&scioq=critical+theory%7Ccritical+theory&hl=en&as_sdt=2007&as_ylo=1998&as_yhi=2023
3682,"N Mackenzie, S Knipe","Research dilemmas: Paradigms, methods and methodology.",2006,Issues in educational research,iier.org.au,http://www.iier.org.au/iier16/mackenzie.html,https://scholar.google.com/scholar?cites=12383101274786986746&as_sdt=2005&sciodt=2007&hl=en,517,1/31/2024 10:28,,,,,,,,,3682,204.56,1841,2,18,"… with a theory (as with postpositivists) rather they ""generate or inductively develop a theory or … Mixed method, like all research approaches, needs to be viewed through a critical lens …",https://www.academia.edu/download/6787014/Research_article_IER.pdf,https://scholar.google.com/scholar?q=related:-npdPQCd2asJ:scholar.google.com/&scioq=critical+theory%7Ccritical+theory&hl=en&as_sdt=2007&as_ylo=1998&as_yhi=2023
162,"D King, M Learmonth",Can critical management studies ever be 'practical'? A case study in engaged scholarship,2015,Human Relations,journals.sagepub.com,https://journals.sagepub.com/doi/abs/10.1177/0018726714528254,https://scholar.google.com/scholar?cites=16979631960617069943&as_sdt=2005&sciodt=2007&hl=en,518,1/31/2024 10:28,,10.1177/0018726714528254,,,,,,,162,18,81,2,9,"… Both of us were managers before we became academics, and we remain particularly interested in the implications of critical theory for the actual practice of management. In revealing …",https://irep.ntu.ac.uk/id/eprint/9804/1/215867_Can%2520Critical%2520Management%2520Studies%2520December%25202013%2520submission.pdf,https://scholar.google.com/scholar?q=related:dy1zZU7Fo-sJ:scholar.google.com/&scioq=critical+theory%7Ccritical+theory&hl=en&as_sdt=2007&as_ylo=1998&as_yhi=2023
4295,JM Morse,Critical analysis of strategies for determining rigor in qualitative inquiry,2015,Qualitative health research,journals.sagepub.com,https://journals.sagepub.com/doi/abs/10.1177/1049732315588501,https://scholar.google.com/scholar?cites=8763766280773568735&as_sdt=2005&sciodt=2007&hl=en,519,1/31/2024 10:28,,10.1177/1049732315588501,,,,,,,4295,477.22,4295,1,9,"… Through particular representation, abstraction, and theory development, validity enables qualitative theories to be generalizable and useful when recontextualized and applied to other …",https://www.researchgate.net/profile/Jorge-Zavala-Castro/publication/291345872_SABERES_Y_PERCEPCIONES_DE_MUJERES_SOBRE_LAS_ENFERMEDADES_TRANSMITIDAS_POR_GARRAPATAS_EN_UNA_COMUNIDAD_RURAL_DE_YUCATAN_MEXICO_RESULTADOS_PRELIMINARES/links/56a132fe08ae2afab88290ba/SABERES-Y-PERCEPCIONES-DE-MUJERES-SOBRE-LAS-ENFERMEDADES-TRANSMITIDAS-POR-GARRAPATAS-EN-UNA-COMUNIDAD-RURAL-DE-YUCATAN-MEXICO-RESULTADOS-PRELIMINARES.pdf#page=17,https://scholar.google.com/scholar?q=related:3wgO_P8mn3kJ:scholar.google.com/&scioq=critical+theory%7Ccritical+theory&hl=en&as_sdt=2007&as_ylo=1998&as_yhi=2023
16673,A Wendt,Social theory of international politics,1999,,books.google.com,https://books.google.com/books?hl=en&lr=&id=s2xjEd0ww2sC&oi=fnd&pg=PR13&dq=critical+theory%7Ccritical+theory&ots=UGkFG8E7OB&sig=Mw1p47ASDRmDZRBdrT6Coh3PIIw,https://scholar.google.com/scholar?cites=10206592955534911054&as_sdt=2005&sciodt=2007&hl=en,520,1/31/2024 10:28,BOOK,,,,,,,,16673,666.92,16673,1,25,"… a variety of social theories - critical theory, postmodernism, feminist theory, historical institutionalism, sociological institutionalism, symbolic interactionism, structuration theory, and the …",https://www.researchgate.net/profile/Alexander-Wendt-6/publication/239065011_A_Social_Theory_of_International_Politics/links/558c0d6b08ae40781c203070/A-Social-Theory-of-International-Politics.pdf,https://scholar.google.com/scholar?q=related:TqapWTcapY0J:scholar.google.com/&scioq=critical+theory%7Ccritical+theory&hl=en&as_sdt=2007&as_ylo=1998&as_yhi=2023
3016,DA Freedman,Statistical models: theory and practice,2009,,books.google.com,https://books.google.com/books?hl=en&lr=&id=fW_9BV5Wpf8C&oi=fnd&pg=PR1&dq=critical+theory%7Ccritical+theory&ots=2jHfZzAQRF&sig=qDOojNzcz0g2tvzTOElYE7OBjUk,https://scholar.google.com/scholar?cites=14926913017349377111&as_sdt=2005&sciodt=2007&hl=en,521,1/31/2024 10:28,BOOK,,,,,,,,3016,201.07,3016,1,15,"… The discussion shows you how to think about the critical issues—including the connection (… At the time, the germ theory of disease was only one of many theories. Miasmas (foul odors, …",,https://scholar.google.com/scholar?q=related:V4xDmE0MJ88J:scholar.google.com/&scioq=critical+theory%7Ccritical+theory&hl=en&as_sdt=2007&as_ylo=1998&as_yhi=2023
13,R Skarin,Generation 1.5 in Hawaii: Gaining critical tools for reading the world,2005,,scholarspace.manoa.hawaii.edu,https://scholarspace.manoa.hawaii.edu/handle/10125/40675,https://scholar.google.com/scholar?cites=3252185168469329865&as_sdt=2005&sciodt=2007&hl=en,522,1/31/2024 10:28,,,,,,,,,13,0.68,13,1,19,"… theories including structuralism, poststructuralism, postmodernism, cultural studies, postcolonial studies, gender studies, and Marxist theory … reciprocity between theories utilized and …",https://scholarspace.manoa.hawaii.edu/bitstreams/fb3c984e-3672-4a29-be8b-c19c9c57ac41/download,https://scholar.google.com/scholar?q=related:yYdoDi4VIi0J:scholar.google.com/&scioq=critical+theory%7Ccritical+theory&hl=en&as_sdt=2007&as_ylo=1998&as_yhi=2023
3778,"F Paas, A Renkl, J Sweller",Cognitive load theory and instructional design: Recent developments,2003,Educational psychologist,Taylor &Francis,https://www.tandfonline.com/doi/pdf/10.1207/S15326985EP3801_1,https://scholar.google.com/scholar?cites=2947026590741599986&as_sdt=2005&sciodt=2007&hl=en,523,1/31/2024 10:28,,10.1207/S15326985EP3801_1,,,,,,,3778,179.9,1259,3,21,"… As the articles in this special issue demonstrate, it is a major theory providing a framework … the extent to which relevant elements interact is a critical feature. Information varies on a contin…",https://www.academia.edu/download/36183118/Educational_Psychologist_paas2.pdf,https://scholar.google.com/scholar?q=related:8pbI_BHx5SgJ:scholar.google.com/&scioq=critical+theory%7Ccritical+theory&hl=en&as_sdt=2007&as_ylo=1998&as_yhi=2023
3087,AJ Scott,"Global city-regions: trends, theory, policy",2001,,books.google.com,https://books.google.com/books?hl=en&lr=&id=mHE0b45cEEUC&oi=fnd&pg=PP1&dq=critical+theory%7Ccritical+theory&ots=MCJvGpWkqY&sig=1eRiPaTGJTy09gKtrboiyYLCNOc,https://scholar.google.com/scholar?cites=5661299723130389812&as_sdt=2005&sciodt=2007&hl=en,524,1/31/2024 10:28,BOOK,,,,,,,,3087,134.22,3087,1,23,"… At a moment when globalization is increasingly subject to critical scrutiny in many different quarters, this book provides a timely overview of its effects on urban and regional development…",,https://scholar.google.com/scholar?q=related:NEU0dBr6kE4J:scholar.google.com/&scioq=critical+theory%7Ccritical+theory&hl=en&as_sdt=2007&as_ylo=1998&as_yhi=2023
4372,DF Halpern,Thought and knowledge: An introduction to critical thinking,2013,,books.google.com,https://books.google.com/books?hl=en&lr=&id=TcsJAgAAQBAJ&oi=fnd&pg=PT13&dq=critical+theory%7Ccritical+theory&ots=1mD2-lNM-p&sig=dDTuYpZ8T3oYwO65ZgKGkWnVzcU,https://scholar.google.com/scholar?cites=5894240137512031574&as_sdt=2005&sciodt=2007&hl=en,525,1/31/2024 10:28,BOOK,,,,,,,,4372,397.45,4372,1,11,"… Halpern, applies theory and research … in critical thinking courses offered in departments of psychology, philosophy, English, humanities, or as a supplement in any course where critical …",http://tandfbis.s3.amazonaws.com/rt-media/pdf/9781848726291/chpt_1.pdf,https://scholar.google.com/scholar?q=related:VhVBES2MzFEJ:scholar.google.com/&scioq=critical+theory%7Ccritical+theory&hl=en&as_sdt=2007&as_ylo=1998&as_yhi=2023
10966,"D De Vaus, D de Vaus",Surveys in social research,2013,,books.google.com,https://books.google.com/books?hl=en&lr=&id=rnxiAgAAQBAJ&oi=fnd&pg=PP1&dq=critical+theory%7Ccritical+theory&ots=6fOJKaluPN&sig=83gz7pilBbNeXBFtT9_Y5-wHhw8,https://scholar.google.com/scholar?cites=9442184350011560056&as_sdt=2005&sciodt=2007&hl=en,526,1/31/2024 10:28,BOOK,,,,,,,,10966,996.91,5483,2,11,… Vaus shows how to become a critical consumer of research. He … tentative theory we have arrived at in the theory construction … A major problem in using existing theories and concepts is …,,https://scholar.google.com/scholar?q=related:eBAxtqNgCYMJ:scholar.google.com/&scioq=critical+theory%7Ccritical+theory&hl=en&as_sdt=2007&as_ylo=1998&as_yhi=2023
2663,"D Hislop, R Bosua, R Helms",Knowledge management in organizations: A critical introduction,2018,,books.google.com,https://books.google.com/books?hl=en&lr=&id=fhFQDwAAQBAJ&oi=fnd&pg=PP1&dq=critical+theory%7Ccritical+theory&ots=0UxZhl0uEq&sig=mhSGmDudYZ0djvIKKEkOgS8PTdI,https://scholar.google.com/scholar?cites=8553187384984154705&as_sdt=2005&sciodt=2007&hl=en,527,1/31/2024 10:28,BOOK,,,,,,,,2663,443.83,888,3,6,"… examples of work utilizing the knowledge-based theory of the firm, which, as outlined, is one of the most important and well-known theories associated with the objectivist perspective on …",https://www.academia.edu/download/84770633/knowledge-management-in-organizations-a-critical-introduction-by-donald-hislop-0199534977.pdf,https://scholar.google.com/scholar?q=related:UTJVI5wGs3YJ:scholar.google.com/&scioq=critical+theory%7Ccritical+theory&hl=en&as_sdt=2007&as_ylo=1998&as_yhi=2023
53,"UB Mir, S Sharma, AK Kar, MP Gupta",Critical success factors for integrating artificial intelligence and robotics,2020,"Digital Policy, Regulation and …",emerald.com,https://www.emerald.com/insight/content/doi/10.1108/DPRG-03-2020-0032/full/html,https://scholar.google.com/scholar?cites=7264613666588722683&as_sdt=2005&sciodt=2007&hl=en,528,1/31/2024 10:28,,10.1108/DPRG-03-2020-0032,,,,,,,53,13.25,13,4,4,… widely used methodologies called critical success factors theory and focus group discussion (… 3.1 Critical success factors theory The idea of “Critical Success Factors” was first proposed …,https://www.researchgate.net/profile/Swapnil-Sharma/publication/343611334_Critical_success_factors_for_integrating_artificial_intelligence_and_robotics/links/617bf2963c987366c3fd3c7d/Critical-success-factors-for-integrating-artificial-intelligence-and-robotics.pdf,https://scholar.google.com/scholar?q=related:-wV446MX0WQJ:scholar.google.com/&scioq=critical+theory%7Ccritical+theory&hl=en&as_sdt=2007&as_ylo=1998&as_yhi=2023
28,H Klein,Critical social is research today: a reflection of past accomplishments and current challenges,2009,Critical management perspectives on information …,api.taylorfrancis.com,https://api.taylorfrancis.com/content/chapters/edit/download?identifierName=doi&identifierValue=10.4324/9780080941684-14&type=chapterpdf,https://scholar.google.com/scholar?cites=13586642849041741248&as_sdt=2005&sciodt=2007&hl=en,529,1/31/2024 10:28,,,,,,,,,28,1.87,28,1,15,"… ’s relativity theories were highly critical of Newton’s physics, but neither one of those two theories are what should be called socially critical; even though Galileo’s heliocentric theory did …",,https://scholar.google.com/scholar?q=related:wPU7o69zjbwJ:scholar.google.com/&scioq=critical+theory%7Ccritical+theory&hl=en&as_sdt=2007&as_ylo=1998&as_yhi=2023
2811,J Mezirow,Transformative learning as discourse,2003,Journal of transformative education,journals.sagepub.com,https://journals.sagepub.com/doi/abs/10.1177/1541344603252172,https://scholar.google.com/scholar?cites=9689031799475142058&as_sdt=2005&sciodt=2007&hl=en,530,1/31/2024 10:28,,10.1177/1541344603252172,,,,,,,2811,133.86,2811,1,21,This article presents an elaboration of the epistemology of transformative learning in adult education. Transformative learning is understood as a uniquely adult form of metacognitive …,https://portals-assets.najah.edu/wesi/media/filer_public/6b/ac/6bacd6ed-bdac-4c93-8a1f-8a262b20c56e/transformative_learning_adult_education.pdf,https://scholar.google.com/scholar?q=related:qv0tQRZbdoYJ:scholar.google.com/&scioq=critical+theory%7Ccritical+theory&hl=en&as_sdt=2007&as_ylo=1998&as_yhi=2023
4732,H Blumer,What is wrong with social theory?,2017,Sociological methods,taylorfrancis.com,https://www.taylorfrancis.com/chapters/edit/10.4324/9781315129945-8/wrong-social-theory-herbert-blumer,https://scholar.google.com/scholar?cites=13507131964858887184&as_sdt=2005&sciodt=2007&hl=en,531,1/31/2024 10:28,,10.4324/9781315129945-8,,,,,,,4732,676,4732,1,7,"… to fit their theories and instead test their theories. Above all, get them to cast their theory into … The showing of such relevancy is a critical difficulty confronting efforts to establish definitive …",,https://scholar.google.com/scholar?q=related:EOy8S_X4crsJ:scholar.google.com/&scioq=critical+theory%7Ccritical+theory&hl=en&as_sdt=2007&as_ylo=1998&as_yhi=2023
3959,MC Jensen,"Value maximization, stakeholder theory, and the corporate objective function",2009,US Corporate governance,degruyter.com,https://www.degruyter.com/document/doi/10.7312/chew14856-001/html,https://scholar.google.com/scholar?cites=10787881021647358196&as_sdt=2005&sciodt=2007&hl=en,532,1/31/2024 10:28,,10.7312/chew14856-001,,,,,,,3959,263.93,3959,1,15,"… Top management plays a critical role in this function through its leadership and … For a critical analysis of stakeholder theory, I especially recommend the following articles by …",https://papers.ssrn.com/sol3/Delivery.cfm/SSRN_ID220671_code000405301.pdf?abstractid=220671.,https://scholar.google.com/scholar?q=related:9Ah47qFAtpUJ:scholar.google.com/&scioq=critical+theory%7Ccritical+theory&hl=en&as_sdt=2007&as_ylo=1998&as_yhi=2023
29,"Q Wen, Q Du, X Zhai",A new analytical model to calculate the maximum tooth root stress and critical section location of spur gear,2018,Mechanism and Machine Theory,Elsevier,https://www.sciencedirect.com/science/article/pii/S0094114X18303549,https://scholar.google.com/scholar?cites=1649142376776383442&as_sdt=2005&sciodt=2007&hl=en,533,1/31/2024 10:28,,,,,,,,,29,4.83,10,3,6,… The new model can determine the critical section location … root stress (TRS) and critical section location (CSL) provides a … model based on the mechanics theory with an accurate profile …,,https://scholar.google.com/scholar?q=related:0rvMD0Hu4hYJ:scholar.google.com/&scioq=critical+theory%7Ccritical+theory&hl=en&as_sdt=2007&as_ylo=1998&as_yhi=2023
