Cites,Authors,Title,Year,Source,Publisher,ArticleURL,CitesURL,GSRank,QueryDate,Type,DOI,ISSN,CitationURL,Volume,Issue,StartPage,EndPage,ECC,CitesPerYear,CitesPerAuthor,AuthorCount,Age,Abstract,FullTextURL,RelatedURL
2366,"G Giuliani, G Vignale",Quantum theory of the electron liquid,2008,,books.google.com,https://books.google.com/books?hl=en&lr=&id=FFydOyv_r78C&oi=fnd&pg=PA50&dq=critical+theory%7Ccritical+theory&ots=E5GiB3JzZq&sig=54m12U66b72kWJOoMfhMrdTozSc,https://scholar.google.com/scholar?cites=6306664266471901743&as_sdt=2005&sciodt=2007&hl=en,723,1/31/2024 10:28,BOOK,,,,,,,,2366,147.88,1183,2,16,… Both static and time-dependent density functional theory are presented in detail. Although the emphasis is on the development of the basic physical ideas and on a critical discussion of …,https://www.researchgate.net/profile/Erio-Tosatti/publication/237702644_Quantum_Theory_of_the_Electron_Liquid/links/5c17848c4585157ac1c81a9c/Quantum-Theory-of-the-Electron-Liquid.pdf,https://scholar.google.com/scholar?q=related:Lwq1eLzFhVcJ:scholar.google.com/&scioq=critical+theory%7Ccritical+theory&hl=en&as_sdt=2007&as_ylo=1998&as_yhi=2023
2452,M Le Bellac,Thermal field theory,2000,,books.google.com,https://books.google.com/books?hl=en&lr=&id=00_x6GR8GXoC&oi=fnd&pg=PR11&dq=critical+theory%7Ccritical+theory&ots=4eTmehWJ-5&sig=Hz5rOgVHp4B5CJCw4PtVul8Vo0E,https://scholar.google.com/scholar?cites=8520880210034028886&as_sdt=2005&sciodt=2007&hl=en,724,1/31/2024 10:28,BOOK,,,,,,,,2452,102.17,2452,1,24,"… In the early 1980s, lattice gauge theories suggested the existence of a deconfined phase of … latent heat; note that we use the terminology 'critical temperature' even for first-order phase …",,https://scholar.google.com/scholar?q=related:VvG7zGc_QHYJ:scholar.google.com/&scioq=critical+theory%7Ccritical+theory&hl=en&as_sdt=2007&as_ylo=1998&as_yhi=2023
2388,"SN Dorogovtsev, AV Goltsev, JFF Mendes",Critical phenomena in complex networks,2008,Reviews of Modern Physics,APS,https://journals.aps.org/rmp/abstract/10.1103/RevModPhys.80.1275,https://scholar.google.com/scholar?cites=11071649237050864190&as_sdt=2005&sciodt=2007&hl=en,725,1/31/2024 10:28,,10.1103/RevModPhys.80.1275,,,,,,,2388,149.25,796,3,16,"The combination of the compactness of networks, featuring small diameters, and their complex architectures results in a variety of critical effects dramatically different from those in …",https://arxiv.org/pdf/0705.0010.pdf),https://scholar.google.com/scholar?q=related:PjIkLFJmppkJ:scholar.google.com/&scioq=critical+theory%7Ccritical+theory&hl=en&as_sdt=2007&as_ylo=1998&as_yhi=2023
4260,PA Facione,Critical thinking: What it is and why it counts,2011,Insight assessment,academia.edu,https://www.academia.edu/download/71022740/what_why98.pdf,https://scholar.google.com/scholar?cites=9176632096923132075&as_sdt=2005&sciodt=2007&hl=en,726,1/31/2024 10:28,PDF,,,,,,,,4260,327.69,4260,1,13,"… In a nutshell this theory suggests that when we settle on a particular option which is good … There is an understanding of the methods, principles, theories and ways of achieving …",https://www.academia.edu/download/71022740/what_why98.pdf,https://scholar.google.com/scholar?q=related:qyCNs0XyWX8J:scholar.google.com/&scioq=critical+theory%7Ccritical+theory&hl=en&as_sdt=2007&as_ylo=1998&as_yhi=2023
6663,"AM Freeman III, JA Herriges, CL Kling",The measurement of environmental and resource values: theory and methods,2014,,books.google.com,https://books.google.com/books?hl=en&lr=&id=sbDAAwAAQBAJ&oi=fnd&pg=PP1&dq=critical+theory%7Ccritical+theory&ots=bEWJjBtw_Q&sig=Hss2w8kHmAJ-AqL9M6TvqcXK4II,https://scholar.google.com/scholar?cites=10999088350032355862&as_sdt=2005&sciodt=2007&hl=en,727,1/31/2024 10:28,BOOK,,,,,,,,6663,666.3,2221,3,10,… critical issues concerning the way we use and interact with environmental and natural resource systems. To reflect recent progress in both the theory … be devoted to the theories of asset …,http://econdse.org/wp-content/uploads/2016/07/Freeman-Herriges-Kling-2014.pdf,https://scholar.google.com/scholar?q=related:FuLQJJScpJgJ:scholar.google.com/&scioq=critical+theory%7Ccritical+theory&hl=en&as_sdt=2007&as_ylo=1998&as_yhi=2023
6923,H Kelsen,General theory of law and state,2017,,taylorfrancis.com,https://www.taylorfrancis.com/books/mono/10.4324/9780203790960/general-theory-law-state-hans-kelsen,https://scholar.google.com/scholar?cites=16946233847551851357&as_sdt=2005&sciodt=2007&hl=en,728,1/31/2024 10:28,BOOK,10.4324/9780203790960,,,,,,,6923,989,6923,1,7,"… On the other hand, some theories of jurisprudence show a tendency to ignore the borderline separating a theory of legal norms regulating human behavior from a science causally …",https://www.academia.edu/download/55908639/Brunet_Review_Kelsen_General_Theor.pdf,https://scholar.google.com/scholar?q=related:XXsHPOYdLesJ:scholar.google.com/&scioq=critical+theory%7Ccritical+theory&hl=en&as_sdt=2007&as_ylo=1998&as_yhi=2023
2530,AR Galloway,Protocol: How control exists after decentralization,2006,,books.google.com,https://books.google.com/books?hl=en&lr=&id=VZ7uDwAAQBAJ&oi=fnd&pg=PR9&dq=critical+theory%7Ccritical+theory&ots=-X_cCn_1rR&sig=eED1VnJi7N2HjmI6Pqcv8IBp3FQ,https://scholar.google.com/scholar?cites=13685260949162383704&as_sdt=2005&sciodt=2007&hl=en,729,1/31/2024 10:28,BOOK,,,,,,,,2530,140.56,2530,1,18,"… For all these reasons, I find my evolution out of literature, critical theory, and film into new media to be a very natural step indeed. I hope literature specialists, philosophers, scientists, …",,https://scholar.google.com/scholar?q=related:WFlZXVPQ670J:scholar.google.com/&scioq=critical+theory%7Ccritical+theory&hl=en&as_sdt=2007&as_ylo=1998&as_yhi=2023
41,"O Druet, E Hebey",Stability for strongly coupled critical elliptic systems in a fully inhomogeneous medium,2009,Anal. PDE,msp.org,https://msp.org/apde/2009/2-3/apde-v2-n3-p.pdf#page=47,https://scholar.google.com/scholar?cites=8177684996411211598&as_sdt=2005&sciodt=2007&hl=en,730,1/31/2024 10:28,,,,,,,,,41,2.73,21,2,15,"… Of importance in blow-up theory, when discussing critical equations, is the classification of the solutions of the critical limit Euclidean system we get by blowing up the original equations. …",https://citeseerx.ist.psu.edu/document?repid=rep1&type=pdf&doi=e6a8bbfb0e358dd35edfb4e003593b64faca58b9#page=47,https://scholar.google.com/scholar?q=related:Tr8hUC35fHEJ:scholar.google.com/&scioq=critical+theory%7Ccritical+theory&hl=en&as_sdt=2007&as_ylo=1998&as_yhi=2023
7020,HE Gardner,Multiple intelligences: New horizons in theory and practice,2008,,books.google.com,https://books.google.com/books?hl=en&lr=&id=8K54fg6YU4EC&oi=fnd&pg=PR7&dq=critical+theory%7Ccritical+theory&ots=mraHenytbO&sig=hCKPTd_oDSqXImpdS7om8T4fLK8,https://scholar.google.com/scholar?cites=17226028168708826132&as_sdt=2005&sciodt=2007&hl=en,731,1/31/2024 10:28,BOOK,,,,,,,,7020,438.75,7020,1,16,… permission except in the case of brief quotations embodied in critical articles and reviews. … sider how the theory might be disproved and compare it with competing theories of intelligence…,,https://scholar.google.com/scholar?q=related:FCTDHlolD-8J:scholar.google.com/&scioq=critical+theory%7Ccritical+theory&hl=en&as_sdt=2007&as_ylo=1998&as_yhi=2023
148,"J Holland, R Thomson",Gaining perspective on choice and fate: revisiting critical moments,2009,European societies,Taylor &Francis,https://www.tandfonline.com/doi/abs/10.1080/14616690902764799,https://scholar.google.com/scholar?cites=12940947166793533011&as_sdt=2005&sciodt=2007&hl=en,732,1/31/2024 10:28,,10.1080/14616690902764799,,,,,,,148,9.87,74,2,15,"… In engaging with late modern theory the researchers were also aware of the many critical … Beck, including those who suggest that such theories simply lead us to focus on accounts of …",,https://scholar.google.com/scholar?q=related:U4bTVeJ6l7MJ:scholar.google.com/&scioq=critical+theory%7Ccritical+theory&hl=en&as_sdt=2007&as_ylo=1998&as_yhi=2023
4629,J Sweller,Cognitive load theory,2011,Psychology of learning and motivation,Elsevier,https://www.sciencedirect.com/science/article/pii/B9780123876911000028,https://scholar.google.com/scholar?cites=5830448945819609209&as_sdt=2005&sciodt=2007&hl=en,733,1/31/2024 10:28,,,,,,,,,4629,356.08,4629,1,13,… theories such as evolution by natural selection are characteristically considered as biological theories… principle is critical to instruction and central to cognitive load theory. Instructional …,http://ndl.ethernet.edu.et/bitstream/123456789/31186/1/125.John%20Sweller.pdf,https://scholar.google.com/scholar?q=related:eeig2Gzq6VAJ:scholar.google.com/&scioq=critical+theory%7Ccritical+theory&hl=en&as_sdt=2007&as_ylo=1998&as_yhi=2023
2273,"VE Stone, S Baron-Cohen, RT Knight",Frontal lobe contributions to theory of mind,1998,Journal of cognitive …,direct.mit.edu,https://direct.mit.edu/jocn/article/10/5/640/3311,https://scholar.google.com/scholar?cites=5722424041295384568&as_sdt=2005&sciodt=2007&hl=en,734,1/31/2024 10:28,,,,,,,,,2273,87.42,758,3,26,… Results from lesion patients thus far have not provided any conclusive evidence about which areas might be critical for theory of mind computations. Patients with damage to orbito-…,https://www.academia.edu/download/40528134/Frontal_Lobe_Contributions_to_Theory_of_20151130-12371-iuqun7.pdf,https://scholar.google.com/scholar?q=related:-A-Ry1giak8J:scholar.google.com/&scioq=critical+theory%7Ccritical+theory&hl=en&as_sdt=2007&as_ylo=1998&as_yhi=2023
5117,B Jessop,State theory,2016,,elgaronline.com,https://www.elgaronline.com/abstract/edcoll/9781782548492/9781782548492.00014.xml,https://scholar.google.com/scholar?cites=3716531616288558366&as_sdt=2005&sciodt=2007&hl=en,735,1/31/2024 10:28,BOOK,,,,,,,,5117,639.63,5117,1,8,"… and governmentality appeal to scholars who are critical of reified state concepts, disillusioned … or so has distinguished state- from societycentered theories in at least two ways. First, an …",,https://scholar.google.com/scholar?q=related:Hk1jYdDFkzMJ:scholar.google.com/&scioq=critical+theory%7Ccritical+theory&hl=en&as_sdt=2007&as_ylo=1998&as_yhi=2023
3954,E Gentzler,Contemporary translation theories,2001,,books.google.com,https://books.google.com/books?hl=en&lr=&id=_jhnUK7cAHYC&oi=fnd&pg=PR2&dq=critical+theory%7Ccritical+theory&ots=nF9plmGL6r&sig=mYsVaMmrd0YMS9U_UCBJSETAD8c,https://scholar.google.com/scholar?cites=6139682340204009351&as_sdt=2005&sciodt=2007&hl=en,736,1/31/2024 10:28,BOOK,,,,,,,,3954,171.91,3954,1,23,"… to translation theory for the first time, this book will review several significant theories of the past three decades and offer a critical assessment of how translation theory might contribute …",,https://scholar.google.com/scholar?q=related:h1eZGY-INFUJ:scholar.google.com/&scioq=critical+theory%7Ccritical+theory&hl=en&as_sdt=2007&as_ylo=1998&as_yhi=2023
2728,"A Kirmani, AR Rao","No pain, no gain: A critical review of the literature on signaling unobservable product quality",2000,Journal of marketing,journals.sagepub.com,https://journals.sagepub.com/doi/abs/10.1509/jmkg.64.2.66.18000,https://scholar.google.com/scholar?cites=9417017224375366655&as_sdt=2005&sciodt=2007&hl=en,737,1/31/2024 10:28,,10.1509/jmkg.64.2.66.18000,,,,,,,2728,113.67,1364,2,24,"… aspects of signaling theory, we now turn to a critical evaluation of the theory. In the next section, we reiterate the general and specific assumptions of signaling theory, discussing their …",https://www.researchgate.net/profile/Amna-Kirmani/publication/246955851_No_Pain_No_Gain_A_Critical_Review_of_the_Literature_on_Signaling_Unobservable_Product_Quality/links/543bd72f0cf204cab1db3f72/No-Pain-No-Gain-A-Critical-Review-of-the-Literature-on-Signaling-Unobservable-Product-Quality.pdf,https://scholar.google.com/scholar?q=related:__OgpkX3r4IJ:scholar.google.com/&scioq=critical+theory%7Ccritical+theory&hl=en&as_sdt=2007&as_ylo=1998&as_yhi=2023
2162,N Couldry,Media rituals: A critical approach,2005,,books.google.com,https://books.google.com/books?hl=en&lr=&id=tTDVxIcMc4YC&oi=fnd&pg=PR8&dq=critical+theory%7Ccritical+theory&ots=aSHVFfR_H9&sig=NMIxA2cra5LIXO7ZzbFRjQhUeHk,https://scholar.google.com/scholar?cites=16642636596407171892&as_sdt=2005&sciodt=2007&hl=en,738,1/31/2024 10:28,BOOK,,,,,,,,2162,113.79,2162,1,19,"… This book uses theory - not abstract theory, but theory informed by empirical research – to understand the dimension of media we find most difficult to understand: the dimension left …",,https://scholar.google.com/scholar?q=related:NPvD1s6F9uYJ:scholar.google.com/&scioq=critical+theory%7Ccritical+theory&hl=en&as_sdt=2007&as_ylo=1998&as_yhi=2023
5280,"KB Beckman, BN Ames",The free radical theory of aging matures,1998,Physiological reviews,journals.physiology.org,https://journals.physiology.org/doi/full/10.1152/physrev.1998.78.2.547?url_ver=Z39.88,https://scholar.google.com/scholar?cites=11020931990017306269&as_sdt=2005&sciodt=2007&hl=en,739,1/31/2024 10:28,HTML,10.1152/physrev.1998.78.2.547,,,,,,,5280,203.08,2640,2,26,"… been an obstacle to testing unified theories. For experimental … a shortage of unified theories attempting to reduce aging to … free radical theory, as a prerequisite to its critical evaluation. …",https://journals.physiology.org/doi/full/10.1152/physrev.1998.78.2.547?url_ver=Z39.88,https://scholar.google.com/scholar?q=related:nW645kA38pgJ:scholar.google.com/&scioq=critical+theory%7Ccritical+theory&hl=en&as_sdt=2007&as_ylo=1998&as_yhi=2023
2202,"S Kotz, S Nadarajah",Extreme value distributions: theory and applications,2000,,books.google.com,https://books.google.com/books?hl=en&lr=&id=GwBqDQAAQBAJ&oi=fnd&pg=PR5&dq=critical+theory%7Ccritical+theory&ots=DEbgcn-dxJ&sig=RvNeXtzffpr0A--R7oPXWNrKQT8,https://scholar.google.com/scholar?cites=2913063240607997134&as_sdt=2005&sciodt=2007&hl=en,740,1/31/2024 10:28,BOOK,,,,,,,,2202,91.75,1101,2,24,"… of probabilistic extreme-value theory and related models … By laying bare the main structure of the theory of extreme … as a useful, balanced and critical introduction and simultaneously a …",,https://scholar.google.com/scholar?q=related:zhywUJVHbSgJ:scholar.google.com/&scioq=critical+theory%7Ccritical+theory&hl=en&as_sdt=2007&as_ylo=1998&as_yhi=2023
58,"R Pinedo‐Cuenca, P Gonzalez Olalla…",Linking Six Sigma's critical success/hindering factors and organizational change (development) A framework and a pilot study,2012,International Journal of …,emerald.com,https://www.emerald.com/insight/content/doi/10.1108/20401461211284752/full/html,https://scholar.google.com/scholar?cites=9412743727570193418&as_sdt=2005&sciodt=2007&hl=en,741,1/31/2024 10:28,,10.1108/20401461211284752,,,,,,,58,4.83,19,3,12,"… a theory‐derived framework suggesting critical success/… (OD), complexity, social worlds theories, etc. in which their … As we focus on OD theory, we found thatthe classifications of …",,https://scholar.google.com/scholar?q=related:Coybo4zIoIIJ:scholar.google.com/&scioq=critical+theory%7Ccritical+theory&hl=en&as_sdt=2007&as_ylo=1998&as_yhi=2023
5374,SH Schwartz,An overview of the Schwartz theory of basic values,2012,Online readings in Psychology and Culture,scholarworks.gvsu.edu,https://scholarworks.gvsu.edu/orpc/vol2/iss1/11/,https://scholar.google.com/scholar?cites=2048368502213348812&as_sdt=2005&sciodt=2007&hl=en,742,1/31/2024 10:28,,,,,,,,,5374,447.83,5374,1,12,… Most critical are relations within the family and other primary groups. Benevolence values … He has since collaborated with some 150 researchers who have applied his theories and …,https://scholarworks.gvsu.edu/cgi/viewcontent.cgi?article=1116&context=orpc,https://scholar.google.com/scholar?q=related:zI2Gz0xEbRwJ:scholar.google.com/&scioq=critical+theory%7Ccritical+theory&hl=en&as_sdt=2007&as_ylo=1998&as_yhi=2023
2391,S Chambers,Deliberative democratic theory,2003,Annual review of political science,annualreviews.org,https://www.annualreviews.org/doi/abs/10.1146/annurev.polisci.6.121901.085538,https://scholar.google.com/scholar?cites=17213280088990016995&as_sdt=2005&sciodt=2007&hl=en,743,1/31/2024 10:28,,10.1146/annurev.polisci.6.121901.085538,,,,,,,2391,113.86,2391,1,21,"… Theories of deliberative democracy contain many empirical claims and assumptions, … tracts of political theory: postmodern difference theory and critical diversity theory. Difference is the …",http://cmapspublic2.ihmc.us/rid=1NBX330Z2-28GR7MP-25X9/Simone%20Chambers%20on%20%20deliberative%20democracy.pdf,https://scholar.google.com/scholar?q=related:4-WNgwrb4e4J:scholar.google.com/&scioq=critical+theory%7Ccritical+theory&hl=en&as_sdt=2007&as_ylo=1998&as_yhi=2023
31,"A Prasad, P Prasad",The postcolonial imagination,2003,… Theory and Organizational Analysis: A Critical …,Springer,https://link.springer.com/chapter/10.1057/9781403982292_12,https://scholar.google.com/scholar?cites=799109607309879457&as_sdt=2005&sciodt=2007&hl=en,744,1/31/2024 10:28,,10.1057/9781403982292_12,,,,,,,31,1.48,16,2,21,"… critical theory has begun to take into account the intellectual contributions of postcolonialism, but rather that critical theory … saying is that, just as critical theory has now begun to examine “…",,https://scholar.google.com/scholar?q=related:oahOOPQBFwsJ:scholar.google.com/&scioq=critical+theory%7Ccritical+theory&hl=en&as_sdt=2007&as_ylo=1998&as_yhi=2023
2220,C Urquhart,Grounded theory for qualitative research: A practical guide,2022,Grounded Theory for Qualitative Research,torrossa.com,https://www.torrossa.com/gs/resourceProxy?an=5409512&publisher=FZ7200,https://scholar.google.com/scholar?cites=3252488945197638043&as_sdt=2005&sciodt=2007&hl=en,745,1/31/2024 10:28,,,,,,,,,2220,1110,2220,1,2,"… This is consistent with the idea of theory building – where we build larger theories from smaller, … It also mentions pragmatist and critical realist grounded theory. Further discussion of the …",https://api.pageplace.de/preview/DT0400.9781446271582_A24016060/preview-9781446271582_A24016060.pdf,https://scholar.google.com/scholar?q=related:m-FjlnYpIy0J:scholar.google.com/&scioq=critical+theory%7Ccritical+theory&hl=en&as_sdt=2007&as_ylo=1998&as_yhi=2023
2433,M Sandelowski,"Combining qualitative and quantitative sampling, data collection, and analysis techniques in mixed‐method studies",2000,Research in nursing &health,Wiley Online Library,https://onlinelibrary.wiley.com/doi/abs/10.1002/1098-240X(200006)23:3%3C246::AID-NUR9%3E3.0.CO;2-H,https://scholar.google.com/scholar?cites=1951012001943512894&as_sdt=2005&sciodt=2007&hl=en,746,1/31/2024 10:28,,10.1002/1098-240X(200006)23:3%3C246::AID-NUR9%3E3.0.CO;2-H,,,,,,,2433,101.38,2433,1,24,"… A critical theorist will frame the issues around hormone … Yet, arguably, the positivist and the critical theorist may not … in positivism and then later, in critical theory. Such worldviews, like all …",https://onlinelibrary.wiley.com/doi/pdf/10.1002/1098-240X%28200006%2923:3%3C246::AID-NUR9%3E3.0.CO;2-H,https://scholar.google.com/scholar?q=related:PuddMBRjExsJ:scholar.google.com/&scioq=critical+theory%7Ccritical+theory&hl=en&as_sdt=2007&as_ylo=1998&as_yhi=2023
22039,"G Burrell, G Morgan",Sociological paradigms and organisational analysis: Elements of the sociology of corporate life,2019,,taylorfrancis.com,https://www.taylorfrancis.com/books/mono/10.4324/9781315609751/sociological-paradigms-organisational-analysis-gibson-burrell-gareth-morgan,https://scholar.google.com/scholar?cites=6678938910914829213&as_sdt=2005&sciodt=2007&hl=en,747,1/31/2024 10:28,BOOK,10.4324/9781315609751,,,,,,,22039,4407.8,11020,2,5,"… erf* critical enquiry, friendship and debate has been a major feature of our enterprise. … that 'all theories of organisation are based upon a philosophy of science and a theory of society’. In …",https://www.academia.edu/download/35244598/166-08-NYASAR-SociologicalParadigm.pdf,https://scholar.google.com/scholar?q=related:nducjY1bsFwJ:scholar.google.com/&scioq=critical+theory%7Ccritical+theory&hl=en&as_sdt=2007&as_ylo=1998&as_yhi=2023
59,"P McLaren, N Jaramillo",Critical pedagogy Latino/a education and the politics of class struggle,2007,pedagogy and praxis in the age of empire,brill.com,https://brill.com/downloadpdf/book/9789087901547/BP000005.pdf,https://scholar.google.com/scholar?cites=6503324410231154107&as_sdt=2005&sciodt=2007&hl=en,748,1/31/2024 10:28,,,,,,,,,59,3.47,30,2,17,"… to discuss critical pedagogy in light of what we perceive to be the importance and efficacy of Marxist theory, … Theories of capitalist hegemony are incomplete without corresponding …",https://www.researchgate.net/profile/Richard-Mitchell/publication/271196903_Power_Pedagogy_and_Praxis_Social_Justice_in_the_Globalized_Classroom/links/5ad89d33458515c60f591b45/Power-Pedagogy-and-Praxis-Social-Justice-in-the-Globalized-Classroom.pdf#page=134,https://scholar.google.com/scholar?q=related:u2X0UhhzQFoJ:scholar.google.com/&scioq=critical+theory%7Ccritical+theory&hl=en&as_sdt=2007&as_ylo=1998&as_yhi=2023
1,A Mukherjee,Measuring information societies: A critical study of the Infostate framework,2008,IFIP International Conference on Human Choice and …,Springer,https://link.springer.com/chapter/10.1007/978-0-387-84822-8_22,https://scholar.google.com/scholar?cites=5899141001836684335&as_sdt=2005&sciodt=2007&hl=en,749,1/31/2024 10:28,,10.1007/978-0-387-84822-8_22,,,,,,,1,0.06,1,1,16,"… In this chapter, I use critical theory to explore the underlying … I suggest a thorough critical study of a wider set of … However, the call for broader theories is being heeded and some very …",https://www.researchgate.net/profile/Kai-Kimppa/publication/45813251_A_no-IPR_model_as_solution_to_reuse_and_understanding_of_information_systems/links/5486e5630cf289302e2db9d6/A-no-IPR-model-as-solution-to-reuse-and-understanding-of-information-systems.pdf#page=333,https://scholar.google.com/scholar?q=related:L-Rqdnz13VEJ:scholar.google.com/&scioq=critical+theory%7Ccritical+theory&hl=en&as_sdt=2007&as_ylo=1998&as_yhi=2023
11478,"DW Stewart, PN Shamdasani",Focus groups: Theory and practice,2014,,books.google.com,https://books.google.com/books?hl=en&lr=&id=1svuAwAAQBAJ&oi=fnd&pg=PP1&dq=critical+theory%7Ccritical+theory&ots=K7D9KF6H4H&sig=jPkfJncykeAArB_0CwH0zZAaLwA,https://scholar.google.com/scholar?cites=13469279838832653317&as_sdt=2005&sciodt=2007&hl=en,750,1/31/2024 10:28,BOOK,,,,,,,,11478,1147.8,5739,2,10,"… The diversity of research purposes, theories, and procedures that characterize the … than others, and it is not age per se that is the critical factor in the behavior of such groups. In addition, …",,https://scholar.google.com/scholar?q=related:BXTzbaZ-7LoJ:scholar.google.com/&scioq=critical+theory%7Ccritical+theory&hl=en&as_sdt=2007&as_ylo=1998&as_yhi=2023
8049,GS Rubin,Thinking sex: Notes for a radical theory of the politics of sexuality,2002,"Culture, society and sexuality",api.taylorfrancis.com,https://api.taylorfrancis.com/content/chapters/edit/download?identifierName=doi&identifierValue=10.4324/9780203020173-13&type=chapterpdf,https://scholar.google.com/scholar?cites=7812678921746211452&as_sdt=2005&sciodt=2007&hl=en,751,1/31/2024 10:28,,,,,,,,,8049,365.86,8049,1,22,"… unimportant topic, a frivolous diversion from the more critical problems of poverty, war, disease, … The Acts were based on erroneous medical theories and did nothing to halt the spread of …",https://repositorio.ufsc.br/bitstream/handle/123456789/1229/rubin_pensando_o_sexo.pdf?se,https://scholar.google.com/scholar?q=related:fGLdAhY2bGwJ:scholar.google.com/&scioq=critical+theory%7Ccritical+theory&hl=en&as_sdt=2007&as_ylo=1998&as_yhi=2023
2825,"CF McKee, EC Ostriker",Theory of star formation,2007,Annu. Rev. Astron. Astrophys.,annualreviews.org,https://www.annualreviews.org/doi/abs/10.1146/annurev.astro.45.051806.110602,https://scholar.google.com/scholar?cites=7587986328137379675&as_sdt=2005&sciodt=2007&hl=en,752,1/31/2024 10:28,,10.1146/annurev.astro.45.051806.110602,,,,,,,2825,166.18,1413,2,17,"… critical balance with a perpendicular cascade yields anisotropic power spectra (larger in the k ⊥ direction); at a given level of power, the theory … physics—when formal theories are either …",https://arxiv.org/pdf/0707.3514.pdf;,https://scholar.google.com/scholar?q=related:Wy8m0VzxTWkJ:scholar.google.com/&scioq=critical+theory%7Ccritical+theory&hl=en&as_sdt=2007&as_ylo=1998&as_yhi=2023
4080,CO Scharmer,Theory U: Learning from the future as it emerges,2009,,books.google.com,https://books.google.com/books?hl=en&lr=&id=ZvDeTBRKmiUC&oi=fnd&pg=PT17&dq=critical+theory%7Ccritical+theory&ots=oottRv1W1b&sig=8yCP6ZCOVt9okqBbahxLXcokN2o,https://scholar.google.com/scholar?cites=16213973320955717702&as_sdt=2005&sciodt=2007&hl=en,753,1/31/2024 10:28,BOOK,,,,,,,,4080,272,4080,1,15,"… be willing to form our critical understanding based on testing the … In that project we looked at all the different theories of … our findings from all these different theories and frameworks, Ed …",https://www.bkconnection.com/static/Theory_U_EXCERPT.pdf,https://scholar.google.com/scholar?q=related:Rug5gdSaA-EJ:scholar.google.com/&scioq=critical+theory%7Ccritical+theory&hl=en&as_sdt=2007&as_ylo=1998&as_yhi=2023
