Cites,Authors,Title,Year,Source,Publisher,ArticleURL,CitesURL,GSRank,QueryDate,Type,DOI,ISSN,CitationURL,Volume,Issue,StartPage,EndPage,ECC,CitesPerYear,CitesPerAuthor,AuthorCount,Age,Abstract,FullTextURL,RelatedURL
56,D Bahri,"Terms of engagement: Postcolonialism, transnationalism, and composition studies",1998,JAC,JSTOR,https://www.jstor.org/stable/20866169,https://scholar.google.com/scholar?cites=11415740813265994097&as_sdt=2005&sciodt=2007&hl=en,124,1/30/2024 21:21,,,,,,,,,56,2.15,56,1,26,"… possibilities for ethical investigation offered by postcolonialism; and to explore the … of postcolonialism, that we may learn the most. … At its most obvious, postcolonialism enters the world …",,https://scholar.google.com/scholar?q=related:cQGmVsnbbJ4J:scholar.google.com/&scioq=postcolonialism%7C%22post+colonialism%22%7Cpostcolonialism%7C%22post+colonialism%22&hl=en&as_sdt=2007&as_ylo=1998&as_yhi=2023
92,M Fludernik,Hybridity and Postcolonialism,1998,Tübingen: Stauffenburg,stauffenburg.de,http://stauffenburg.de/restore/asp/books.asp?id=67,https://scholar.google.com/scholar?cites=1069624855476762719&as_sdt=2005&sciodt=2007&hl=en,125,1/30/2024 21:21,,,,,,,,,92,3.54,92,1,26,Recent debates on postcolonial literatures have increasingly come to resort to the term hybridity. The present volume seeks to discuss the concept of hybridity in relation to (expatriate) …,,https://scholar.google.com/scholar?q=related:X_iekSMS2A4J:scholar.google.com/&scioq=postcolonialism%7C%22post+colonialism%22%7Cpostcolonialism%7C%22post+colonialism%22&hl=en&as_sdt=2007&as_ylo=1998&as_yhi=2023
196,AJ Paolini,"Navigating modernity: Postcolonialism, identity, and international relations",1999,,books.google.com,https://books.google.com/books?hl=en&lr=&id=T7grrf5eQ9MC&oi=fnd&pg=PR9&dq=postcolonialism%7C%22post+colonialism%22%7Cpostcolonialism%7C%22post+colonialism%22&ots=CROeFQ-cEs&sig=pDq6TQ6usyCeuSMTYikL0WEf26s,https://scholar.google.com/scholar?cites=2543533318180409512&as_sdt=2005&sciodt=2007&hl=en,126,1/30/2024 21:21,BOOK,,,,,,,,196,7.84,196,1,25,""" Paolini is concerned with the connections among postcolonialism, globalization, and modernity, and he offers one of the first detailed statements of those connections to be undertaken …",,https://scholar.google.com/scholar?q=related:qJCDoBNyTCMJ:scholar.google.com/&scioq=postcolonialism%7C%22post+colonialism%22%7Cpostcolonialism%7C%22post+colonialism%22&hl=en&as_sdt=2007&as_ylo=1998&as_yhi=2023
203,S Mukherjee,Videogames and postcolonialism: Empire plays back,2017,,Springer,https://link.springer.com/content/pdf/10.1007/978-3-319-54822-7.pdf,https://scholar.google.com/scholar?cites=15625508243648047446&as_sdt=2005&sciodt=2007&hl=en,127,1/30/2024 21:21,BOOK,10.1007/978-3-319-54822-7,,,,,,,203,29,203,1,7,"… Philip Leonard, whose versatile example as a scholar of both post colonialism and digital … Her work on early modern post colonialism has always fascinated me and her expertise and …",,https://scholar.google.com/scholar?q=related:VmmUyfX02NgJ:scholar.google.com/&scioq=postcolonialism%7C%22post+colonialism%22%7Cpostcolonialism%7C%22post+colonialism%22&hl=en&as_sdt=2007&as_ylo=1998&as_yhi=2023
155,RJC Young,"Empire, colony, postcolony",2015,,books.google.com,https://books.google.com/books?hl=en&lr=&id=rGXKCQAAQBAJ&oi=fnd&pg=PP8&dq=postcolonialism%7C%22post+colonialism%22%7Cpostcolonialism%7C%22post+colonialism%22&ots=SjJFseUxGw&sig=ML6QJrnJ-UImkc1XCQDgin6bIAI,https://scholar.google.com/scholar?cites=6513750636616841950&as_sdt=2005&sciodt=2007&hl=en,128,1/30/2024 21:21,BOOK,,,,,,,,155,17.22,155,1,9,"… dimensions of colonialism, imperialism, and postcolonialism, with clear explanations of these … of the contemporary world Written by an acknowledged expert on postcolonialism …",,https://scholar.google.com/scholar?q=related:3noFU7F9ZVoJ:scholar.google.com/&scioq=postcolonialism%7C%22post+colonialism%22%7Cpostcolonialism%7C%22post+colonialism%22&hl=en&as_sdt=2007&as_ylo=1998&as_yhi=2023
50,K James-Chakraborty,Beyond postcolonialism: New directions for the history of nonwestern architecture,2014,Frontiers of Architectural Research,Elsevier,https://www.sciencedirect.com/science/article/pii/S2095263513000642,https://scholar.google.com/scholar?cites=8703669932622101755&as_sdt=2005&sciodt=2007&hl=en,129,1/30/2024 21:21,HTML,,,,,,,,50,5,50,1,10,"Overturning assumptions that nonwestern architecture has been static over time, new scholarship focused on colonial and postcolonial architecture and urbanism and on nonwestern …",https://www.sciencedirect.com/science/article/pii/S2095263513000642,https://scholar.google.com/scholar?q=related:-zwwkLClyXgJ:scholar.google.com/&scioq=postcolonialism%7C%22post+colonialism%22%7Cpostcolonialism%7C%22post+colonialism%22&hl=en&as_sdt=2007&as_ylo=1998&as_yhi=2023
143,M Mookherjee,"Affective citizenship: Feminism, postcolonialism and the politics of recognition",2005,Critical review of international social and political …,Taylor &Francis,https://www.tandfonline.com/doi/abs/10.1080/1369823042000335830,https://scholar.google.com/scholar?cites=1850838102710890497&as_sdt=2005&sciodt=2007&hl=en,130,1/30/2024 21:21,,10.1080/1369823042000335830,,,,,,,143,7.53,143,1,19,A serious problem confronting discourses on recognition is that of showing equal respect for citizens’ diverse cultural identities whilst at the same time attending to feminist concerns. …,,https://scholar.google.com/scholar?q=related:ATDXwHJ_rxkJ:scholar.google.com/&scioq=postcolonialism%7C%22post+colonialism%22%7Cpostcolonialism%7C%22post+colonialism%22&hl=en&as_sdt=2007&as_ylo=1998&as_yhi=2023
11,"D Davies, E Boehmer",Postcolonialism and south–south relations,2018,Routledge handbook of south-south …,taylorfrancis.com,https://www.taylorfrancis.com/chapters/edit/10.4324/9781315624495-3/postcolonialism-south%E2%80%93south-relations-dominic-davies-elleke-boehmer,https://scholar.google.com/scholar?cites=13268341753825923679&as_sdt=2005&sciodt=2007&hl=en,131,1/30/2024 21:21,,10.4324/9781315624495-3/postcolonialism-south%E2%80%93south-relations-dominic-davies-elleke-boehmer,,,,,,,11,1.83,6,2,6,"Postcolonialism or postcolonial studies is a critical … While postcolonialism, therefore, grows out of the radicalism of South… If postcolonialism is then the main avenue through which South–…",https://openaccess.city.ac.uk/id/eprint/23701/8/,https://scholar.google.com/scholar?q=related:XxJHw4aeIrgJ:scholar.google.com/&scioq=postcolonialism%7C%22post+colonialism%22%7Cpostcolonialism%7C%22post+colonialism%22&hl=en&as_sdt=2007&as_ylo=1998&as_yhi=2023
65,J Lavia,"Repositioning pedagogies and postcolonialism: Theories, contradictions and possibilities",2007,International Journal of Inclusive Education,Taylor &Francis,https://www.tandfonline.com/doi/abs/10.1080/13603110701237548,https://scholar.google.com/scholar?cites=9213366424094478494&as_sdt=2005&sciodt=2007&hl=en,132,1/30/2024 21:21,,10.1080/13603110701237548,,,,,,,65,3.82,65,1,17,… postcolonialism that provides a set of lenses through which the persistent and insidious legacies of European colonialism can be made visible. ‘Postcolonialism … ‘postcolonialism claims …,,https://scholar.google.com/scholar?q=related:npCpvfJz3H8J:scholar.google.com/&scioq=postcolonialism%7C%22post+colonialism%22%7Cpostcolonialism%7C%22post+colonialism%22&hl=en&as_sdt=2007&as_ylo=1998&as_yhi=2023
140,E Watts,Writing and Postcolonialism in the Early Republic,1998,,books.google.com,https://books.google.com/books?hl=en&lr=&id=J4Fw98meK1QC&oi=fnd&pg=PP13&dq=postcolonialism%7C%22post+colonialism%22%7Cpostcolonialism%7C%22post+colonialism%22&ots=91mLUtb8xn&sig=wOPV6Q31KlkmceXOQiMxnNzpryM,https://scholar.google.com/scholar?cites=13122000027015056547&as_sdt=2005&sciodt=2007&hl=en,133,1/30/2024 21:21,BOOK,,,,,,,,140,5.38,140,1,26,"… Many scholars of postcolonialism would resist this assignment: the United States is more often viewed as part of the colonizing world than part of the colonized. Indeed, the United …",,https://scholar.google.com/scholar?q=related:owzmUIC1GrYJ:scholar.google.com/&scioq=postcolonialism%7C%22post+colonialism%22%7Cpostcolonialism%7C%22post+colonialism%22&hl=en&as_sdt=2007&as_ylo=1998&as_yhi=2023
116,S Andermahr,“Decolonizing Trauma Studies: Trauma and Postcolonialism”—Introduction,2015,Humanities,mdpi.com,https://www.mdpi.com/2076-0787/4/4/500/htm,https://scholar.google.com/scholar?cites=2819935782782729258&as_sdt=2005&sciodt=2007&hl=en,134,1/30/2024 21:21,HTML,,,,,,,,116,12.89,116,1,9,"This Special Issue aims to explore the complex and contested relationship between trauma studies and postcolonial criticism, focusing on the ongoing project to create a decolonized …",https://www.mdpi.com/2076-0787/4/4/500/htm,https://scholar.google.com/scholar?q=related:KnwtXqdsIicJ:scholar.google.com/&scioq=postcolonialism%7C%22post+colonialism%22%7Cpostcolonialism%7C%22post+colonialism%22&hl=en&as_sdt=2007&as_ylo=1998&as_yhi=2023
331,"K Loftsdóttir, L Jensen","Whiteness and postcolonialism in the Nordic region: Exceptionalism, migrant others and national identities",2016,,books.google.com,https://books.google.com/books?hl=en&lr=&id=QveNCwAAQBAJ&oi=fnd&pg=PP1&dq=postcolonialism%7C%22post+colonialism%22%7Cpostcolonialism%7C%22post+colonialism%22&ots=_pkmhnFZKV&sig=MgnpzHccf7vXD6L6Ze7feca5qDI,https://scholar.google.com/scholar?cites=2081610335975889612&as_sdt=2005&sciodt=2007&hl=en,135,1/30/2024 21:21,BOOK,,,,,,,,331,41.38,166,2,8,"This book examines the influence of imperialism and colonialism on the formation of national identities in the Nordic countries, exploring the manner in which contemporary discourses …",,https://scholar.google.com/scholar?q=related:zNqfXJJd4xwJ:scholar.google.com/&scioq=postcolonialism%7C%22post+colonialism%22%7Cpostcolonialism%7C%22post+colonialism%22&hl=en&as_sdt=2007&as_ylo=1998&as_yhi=2023
109,M Vautier,New world myth: Postmodernism and postcolonialism in Canadian fiction,1998,,books.google.com,https://books.google.com/books?hl=en&lr=&id=AiStosa7DsQC&oi=fnd&pg=PR7&dq=postcolonialism%7C%22post+colonialism%22%7Cpostcolonialism%7C%22post+colonialism%22&ots=ssAT6oGBnq&sig=nFK6zPyK4fpY8rxzdOom5d2Cr9Q,https://scholar.google.com/scholar?cites=6784032209289769428&as_sdt=2005&sciodt=2007&hl=en,136,1/30/2024 21:21,BOOK,,,,,,,,109,4.19,109,1,26,"… of postcolonialism … 'postcolonialism"" were not as well known as they are in the 1990s. I do not attempt to establish theoretical distinctions between postmodernism and postcolonialism in …",,https://scholar.google.com/scholar?q=related:1HGG21m5JV4J:scholar.google.com/&scioq=postcolonialism%7C%22post+colonialism%22%7Cpostcolonialism%7C%22post+colonialism%22&hl=en&as_sdt=2007&as_ylo=1998&as_yhi=2023
40,V Kelertas,Baltic postcolonialism and its critics,2006,Baltic Postcolonialism,brill.com,https://brill.com/downloadpdf/book/9789401202770/B9789401202770_s003.pdf,https://scholar.google.com/scholar?cites=9050412198776686106&as_sdt=2005&sciodt=2007&hl=en,137,1/30/2024 21:21,,,,,,,,,40,2.22,40,1,18,"This book on Baltic postcolonialism features the groundbreaking effort of some 15 scholars. Yet, it is still unusual to see or hear the term “postcolonial” applied to the Baltic States. Thus, …",,https://scholar.google.com/scholar?q=related:GkbykvGFmX0J:scholar.google.com/&scioq=postcolonialism%7C%22post+colonialism%22%7Cpostcolonialism%7C%22post+colonialism%22&hl=en&as_sdt=2007&as_ylo=1998&as_yhi=2023
64,C McEwan,A very modern ghost: postcolonialism and the politics of enchantment,2008,Environment and planning d: society and space,journals.sagepub.com,https://journals.sagepub.com/doi/abs/10.1068/d460t,https://scholar.google.com/scholar?cites=5560871893337139974&as_sdt=2005&sciodt=2007&hl=en,138,1/30/2024 21:21,,10.1068/d460t,,,,,,,64,4,64,1,16,"Ghosts, spectres, and spirits and the stories told about them have long been a source of intellectual inquiry; they appear to be everywhere in scholarly discourse yet are largely absent …",https://citeseerx.ist.psu.edu/document?repid=rep1&type=pdf&doi=99ddd5f592e15e53ebb016f3676e818e6d965954,https://scholar.google.com/scholar?q=related:BmvQM4YvLE0J:scholar.google.com/&scioq=postcolonialism%7C%22post+colonialism%22%7Cpostcolonialism%7C%22post+colonialism%22&hl=en&as_sdt=2007&as_ylo=1998&as_yhi=2023
62,LM Harris,"Modernizing the nation: Postcolonialism, postdevelopmentalism, and ambivalent spaces of difference in southeastern Turkey",2008,Geoforum,Elsevier,https://www.sciencedirect.com/science/article/pii/S0016718508000420,https://scholar.google.com/scholar?cites=15908290622311172074&as_sdt=2005&sciodt=2007&hl=en,139,1/30/2024 21:21,,,,,,,,,62,3.88,62,1,16,"This paper advances recent conversations related to the need to better engage postcolonial scholarship in development geography. To do so, I bring together analytics offered by …",https://open.library.ubc.ca/media/download/pdf/52383/1.0357980/2,https://scholar.google.com/scholar?q=related:6geJBgmaxdwJ:scholar.google.com/&scioq=postcolonialism%7C%22post+colonialism%22%7Cpostcolonialism%7C%22post+colonialism%22&hl=en&as_sdt=2007&as_ylo=1998&as_yhi=2023
113,AAH Al-Saidi,Post-colonialism Literature the Concept of self and the other in Coetzee's Waiting for the Barbarians: An Analytical Approach,2014,Journal of Language Teaching and Research,academia.edu,https://www.academia.edu/download/67205175/05aac11e3070aa5c8f0275b374daa8516f01.pdf,https://scholar.google.com/scholar?cites=6416048029025198483&as_sdt=2005&sciodt=2007&hl=en,140,1/30/2024 21:21,PDF,,,,,,,,113,11.3,113,1,10,"… Post-colonialism is continually described as a term that portrays not a ""we"" talking about or to ""them"", but a ""them"" talking back to an ""us"". This implies that post-colonial literature in one …",https://www.academia.edu/download/67205175/05aac11e3070aa5c8f0275b374daa8516f01.pdf,https://scholar.google.com/scholar?q=related:k2HkT7BhClkJ:scholar.google.com/&scioq=postcolonialism%7C%22post+colonialism%22%7Cpostcolonialism%7C%22post+colonialism%22&hl=en&as_sdt=2007&as_ylo=1998&as_yhi=2023
70,LL Adams,"Modernity, postcolonialism, and theatrical form in Uzbekistan",2005,Slavic Review,cambridge.org,https://www.cambridge.org/core/journals/slavic-review/article/modernity-postcolonialism-and-theatrical-form-in-uzbekistan/0AB1AD73684A7C04D41EF429C2ECF95E,https://scholar.google.com/scholar?cites=7915830839255506886&as_sdt=2005&sciodt=2007&hl=en,141,1/30/2024 21:21,,,,,,,,,70,3.68,70,1,19,In this article Laura Adams examines cultural change in Uzbekistan through the evolution of European-style theater during the twentieth century. The adoption of this theatrical form was …,,https://scholar.google.com/scholar?q=related:xh_oWzWu2m0J:scholar.google.com/&scioq=postcolonialism%7C%22post+colonialism%22%7Cpostcolonialism%7C%22post+colonialism%22&hl=en&as_sdt=2007&as_ylo=1998&as_yhi=2023
59,"A Smith, W Hughes",Introduction: The Enlightenment Gothic and Postcolonialism,2003,Empire and the Gothic: The politics of genre,Springer,https://link.springer.com/chapter/10.1057/9781403919342_1,https://scholar.google.com/scholar?cites=5142103032842206168&as_sdt=2005&sciodt=2007&hl=en,142,1/30/2024 21:21,,10.1057/9781403919342_1,,,,,,,59,2.81,30,2,21,"Theories of postcolonialism and scholarship on the Gothic might, superficially, appear to be the product of rather different intellectual, cultural and historical traditions. The Gothic, a …",,https://scholar.google.com/scholar?q=related:2LsE33ZrXEcJ:scholar.google.com/&scioq=postcolonialism%7C%22post+colonialism%22%7Cpostcolonialism%7C%22post+colonialism%22&hl=en&as_sdt=2007&as_ylo=1998&as_yhi=2023
74,P Goulimari,Literary criticism and theory: From Plato to Postcolonialism,2014,,books.google.com,https://books.google.com/books?hl=en&lr=&id=1SGDBAAAQBAJ&oi=fnd&pg=PP1&dq=postcolonialism%7C%22post+colonialism%22%7Cpostcolonialism%7C%22post+colonialism%22&ots=Nc_8AayPWb&sig=98b41uVrLVcw4k3Ufhg1yYp3fgk,https://scholar.google.com/scholar?cites=8265465972726371370&as_sdt=2005&sciodt=2007&hl=en,143,1/30/2024 21:21,BOOK,,,,,,,,74,7.4,74,1,10,This incredibly useful volume offers an introduction to the history of literary criticism and theory from ancient Greece to the present. Grounded in the close reading of landmark theoretical …,https://michaelpalmer.up.seesaa.net/image/Literary20Criticism20and20Theory_20From20Plato20to20Postcolonialism.pdf,https://scholar.google.com/scholar?q=related:KhRvh4LVtHIJ:scholar.google.com/&scioq=postcolonialism%7C%22post+colonialism%22%7Cpostcolonialism%7C%22post+colonialism%22&hl=en&as_sdt=2007&as_ylo=1998&as_yhi=2023
69,A Krupat,"Postcolonialism, ideology, and Native American literature",2000,Postcolonial theory and the United States: Race …,books.google.com,https://books.google.com/books?hl=en&lr=&id=g-tMficUIS8C&oi=fnd&pg=PA73&dq=postcolonialism%7C%22post+colonialism%22%7Cpostcolonialism%7C%22post+colonialism%22&ots=7FLqiD2EyF&sig=HLvaC1WD8__pV01VKE3eUONxQjI,https://scholar.google.com/scholar?cites=15180480635623590309&as_sdt=2005&sciodt=2007&hl=en,144,1/30/2024 21:21,,,,,,,,,69,2.88,69,1,24,"Arnold Krupat n the current climate of literary studies, it is tempting to think of contemporary Native American literatures as among the postcolonial literatures of the world. Certainly they …",,https://scholar.google.com/scholar?q=related:pUkKXrXmq9IJ:scholar.google.com/&scioq=postcolonialism%7C%22post+colonialism%22%7Cpostcolonialism%7C%22post+colonialism%22&hl=en&as_sdt=2007&as_ylo=1998&as_yhi=2023
89,S O'Brien,"Articulating a world of difference: Ecocriticism, postcolonialism and globalization",2001,Canadian Literature,ojs.library.ubc.ca,https://ojs.library.ubc.ca/index.php/canlit/article/view/193127/189588,https://scholar.google.com/scholar?cites=17930257207536651452&as_sdt=2005&sciodt=2007&hl=en,145,1/30/2024 21:21,PDF,,,,,,,,89,3.87,89,1,23,"In The World, the Text and the Critic, Edward Said counters the generally textualist tendency of literary critical conversation of the early nineteen-eighties with an argument about the …",https://ojs.library.ubc.ca/index.php/canlit/article/view/193127/189588,https://scholar.google.com/scholar?q=related:vAycgu4R1fgJ:scholar.google.com/&scioq=postcolonialism%7C%22post+colonialism%22%7Cpostcolonialism%7C%22post+colonialism%22&hl=en&as_sdt=2007&as_ylo=1998&as_yhi=2023
86,"H Shin, R Kubota",Post‐Colonialism and Globalization in Language Education,2008,The handbook of educational linguistics,Wiley Online Library,https://onlinelibrary.wiley.com/doi/pdf/10.1002/9780470694138#page=225,https://scholar.google.com/scholar?cites=10881559828910851806&as_sdt=2005&sciodt=2007&hl=en,146,1/30/2024 21:21,,10.1002/9780470694138,,,,,,,86,5.38,43,2,16,"… : post-colonialism and globalization. Supporting the view that inquiry into post-colonialism goes … (see Loomba, 1998), we locate postcolonialism in a past, present, and future trajectory of …",http://ndl.ethernet.edu.et/bitstream/123456789/65606/1/54.pdf.pdf#page=230,https://scholar.google.com/scholar?q=related:3kZk7AIRA5cJ:scholar.google.com/&scioq=postcolonialism%7C%22post+colonialism%22%7Cpostcolonialism%7C%22post+colonialism%22&hl=en&as_sdt=2007&as_ylo=1998&as_yhi=2023
129,"AG Hargreaves, C Forsdick, D Murphy, N Hertel",Transnational French studies: postcolonialism and littérature-monde,2010,,books.google.com,https://books.google.com/books?hl=en&lr=&id=EpCKwfmIdiMC&oi=fnd&pg=PR7&dq=postcolonialism%7C%22post+colonialism%22%7Cpostcolonialism%7C%22post+colonialism%22&ots=T5CdBtm0Ms&sig=2BsbiKRVMGnM2pOr9WVQxx9pBrQ,https://scholar.google.com/scholar?cites=11967537656683760820&as_sdt=2005&sciodt=2007&hl=en,147,1/30/2024 21:21,BOOK,,,,,,,,129,9.21,32,4,14,"The 2007 manifesto in favour of a"" Littérature-monde en français"" has generated new debates in both"" francophone"" and"" postcolonial"" studies. Praised by some for breaking down the …",,https://scholar.google.com/scholar?q=related:tAy_jhc8FaYJ:scholar.google.com/&scioq=postcolonialism%7C%22post+colonialism%22%7Cpostcolonialism%7C%22post+colonialism%22&hl=en&as_sdt=2007&as_ylo=1998&as_yhi=2023
65,C Barnett,"12 POSTCOLONIALISM: SPACE, TEXTUALITY, AND POWER",2006,Approaches to human geography,books.google.com,https://books.google.com/books?hl=en&lr=&id=7ld-xHIAefoC&oi=fnd&pg=PA147&dq=postcolonialism%7C%22post+colonialism%22%7Cpostcolonialism%7C%22post+colonialism%22&ots=bO9KNwWe2p&sig=hKYDAISJowz9efoabklS0VZQaE8,https://scholar.google.com/scholar?cites=13160631304616747058&as_sdt=2005&sciodt=2007&hl=en,148,1/30/2024 21:21,,,,,,,,,65,3.61,65,1,18,"As a field of academic inquiry, postcolonialism has its intellectual origins in the writings of a number of intellectuals who came to prominence in the middle part of the twentieth century, …",https://oro.open.ac.uk/7158/1/submitted_postcolonialism_chapter_valentine_and_aitken1.pdf,https://scholar.google.com/scholar?q=related:MiCRi3H0o7YJ:scholar.google.com/&scioq=postcolonialism%7C%22post+colonialism%22%7Cpostcolonialism%7C%22post+colonialism%22&hl=en&as_sdt=2007&as_ylo=1998&as_yhi=2023
46,NR Altschul,Postcolonialism and the Study of the Middle Ages,2008,History Compass,Wiley Online Library,https://compass.onlinelibrary.wiley.com/doi/abs/10.1111/j.1478-0542.2008.00510.x,https://scholar.google.com/scholar?cites=12318447694767987893&as_sdt=2005&sciodt=2007&hl=en,149,1/30/2024 21:21,,10.1111/j.1478-0542.2008.00510.x,,,,,,,46,2.88,46,1,16,This article focuses on the use of postcolonial criticism in the study of the European Middle Ages. It concentrates on two issues critiqued in particular by historians: anachronism and …,https://www.academia.edu/download/38051116/Altschul_HistoryCompass_2008.pdf,https://scholar.google.com/scholar?q=related:tRzglunq86oJ:scholar.google.com/&scioq=postcolonialism%7C%22post+colonialism%22%7Cpostcolonialism%7C%22post+colonialism%22&hl=en&as_sdt=2007&as_ylo=1998&as_yhi=2023
276,G Huggan,"Australian literature: postcolonialism, racism, transnationalism",2007,,books.google.com,https://books.google.com/books?hl=en&lr=&id=zBG0lA9cGaoC&oi=fnd&pg=PT5&dq=postcolonialism%7C%22post+colonialism%22%7Cpostcolonialism%7C%22post+colonialism%22&ots=wqY7AQbJlm&sig=-vVoY6bd189QUA1ubGv28zvkfIU,https://scholar.google.com/scholar?cites=2818293536811699418&as_sdt=2005&sciodt=2007&hl=en,150,1/30/2024 21:21,BOOK,,,,,,,,276,16.24,276,1,17,"… Postcolonialism, it suggests, is less the … postcolonialism capable of generating new ways of thinking about the nation and the national, and the need for a comparative postcolonialism in …",,https://scholar.google.com/scholar?q=related:2sxwLgqXHCcJ:scholar.google.com/&scioq=postcolonialism%7C%22post+colonialism%22%7Cpostcolonialism%7C%22post+colonialism%22&hl=en&as_sdt=2007&as_ylo=1998&as_yhi=2023
173,"G Jack, R Westwood",Postcolonialism and the politics of qualitative research in international business,2006,Management International Review,Springer,https://link.springer.com/article/10.1007/s11575-006-0102-x,https://scholar.google.com/scholar?cites=12040798049994739815&as_sdt=2005&sciodt=2007&hl=en,151,1/30/2024 21:21,,10.1007/s11575-006-0102-x,,,,,,,173,9.61,87,2,18,"… We suggest that postcolonialism provides one avenue for this. … In addressing this imperative, it is useful to summarize explicitly and discuss what our partial outline of postcolonialism …",https://www.researchgate.net/profile/Robert-Westwood/publication/272943452_Postcolonialism_and_the_Politics_of_Qualitative_Research_in_International_Business/links/54f50a2f0cf2eed5d735eeda/Postcolonialism-and-the-Politics-of-Qualitative-Research-in-International-Business.pdf,https://scholar.google.com/scholar?q=related:ZxAnFgiCGacJ:scholar.google.com/&scioq=postcolonialism%7C%22post+colonialism%22%7Cpostcolonialism%7C%22post+colonialism%22&hl=en&as_sdt=2007&as_ylo=1998&as_yhi=2023
106,L Davis,"Music, postcolonialism, and gender: The construction of Irish national identity, 1724–1874",2006,,muse.jhu.edu,https://muse.jhu.edu/pub/200/monograph/book/99032,https://scholar.google.com/scholar?cites=11620376000361836731&as_sdt=2005&sciodt=2007&hl=en,152,1/30/2024 21:21,BOOK,,,,,,,,106,5.89,106,1,18,"In Music, Postcolonialism, and Gender, Leith Davis studies the construction of Irish national identity from the early eighteenth until the mid-nineteenth centuries, focusing in particular on …",,https://scholar.google.com/scholar?q=related:u7AKqmfeQ6EJ:scholar.google.com/&scioq=postcolonialism%7C%22post+colonialism%22%7Cpostcolonialism%7C%22post+colonialism%22&hl=en&as_sdt=2007&as_ylo=1998&as_yhi=2023
255,L Rodríguez-Piñero,"Indigenous peoples, postcolonialism, and international law: The ILO regime (1919–1989)",2005,,academic.oup.com,https://academic.oup.com/book/50398,https://scholar.google.com/scholar?cites=8769210811719893627&as_sdt=2005&sciodt=2007&hl=en,153,1/30/2024 21:21,BOOK,,,,,,,,255,13.42,255,1,19,"Indigenous Peoples, Postcolonialism, and International Law: The ILO Regime (1919–1989) | Oxford … National Liberation and Post-Colonialism … National Liberation and Post-Colonialism …",,https://scholar.google.com/scholar?q=related:e0IUocV-snkJ:scholar.google.com/&scioq=postcolonialism%7C%22post+colonialism%22%7Cpostcolonialism%7C%22post+colonialism%22&hl=en&as_sdt=2007&as_ylo=1998&as_yhi=2023
