Cites,Authors,Title,Year,Source,Publisher,ArticleURL,CitesURL,GSRank,QueryDate,Type,DOI,ISSN,CitationURL,Volume,Issue,StartPage,EndPage,ECC,CitesPerYear,CitesPerAuthor,AuthorCount,Age,Abstract,FullTextURL,RelatedURL
105,R Sethi,"The politics of postcolonialism: Empire, nation and resistance",2011,(No Title),cir.nii.ac.jp,https://cir.nii.ac.jp/crid/1130000796932110464,https://scholar.google.com/scholar?cites=10876021462636227587&as_sdt=2005&sciodt=2007&hl=en,368,1/30/2024 21:21,CITATION,,,,,,,,105,8.08,105,1,13,"The politics of postcolonialism : empire, nation and resistance | CiNii Research … The politics of postcolonialism : empire, nation and resistance … タイトル ""The politics of …",,https://scholar.google.com/scholar?q=related:A-z0ieVj75YJ:scholar.google.com/&scioq=postcolonialism%7C%22post+colonialism%22%7Cpostcolonialism%7C%22post+colonialism%22&hl=en&as_sdt=2007&as_ylo=1998&as_yhi=2023
1,T Nakajima,"Think outside the box! Jung, Lévi-Strauss, and postcolonialism (individual, society, and institutes): spectrum of psychology and sociology",2018,International Journal of Jungian Studies,brill.com,https://brill.com/view/journals/ijjs/10/3/article-p237_6.xml,https://scholar.google.com/scholar?cites=15842134643142448497&as_sdt=2005&sciodt=2007&hl=en,369,1/30/2024 21:21,,,,,,,,,1,0.17,1,1,6,"The resemblance between Claude Lévi-Strauss’s structuralism and Carl Jung’s theory of the archetypes of the collective unconscious has been occasionally discussed. However, Lévi-…",,https://scholar.google.com/scholar?q=related:cVVq0IWR2tsJ:scholar.google.com/&scioq=postcolonialism%7C%22post+colonialism%22%7Cpostcolonialism%7C%22post+colonialism%22&hl=en&as_sdt=2007&as_ylo=1998&as_yhi=2023
101,V Kaiwar,The postcolonial Orient: the politics of difference and the project of provincialising Europe,2014,The Postcolonial Orient,brill.com,https://brill.com/display/title/21876,https://scholar.google.com/scholar?cites=10633263406691515107&as_sdt=2005&sciodt=2007&hl=en,370,1/30/2024 21:21,,,,,,,,,101,10.1,101,1,10,… The valences of the ‘post’ in postcolonialism are unfolded via some key historical-political … ’ are possible than with a postcolonialism captive to phenomenological-existentialism and post…,,https://scholar.google.com/scholar?q=related:4_oBH7vwkJMJ:scholar.google.com/&scioq=postcolonialism%7C%22post+colonialism%22%7Cpostcolonialism%7C%22post+colonialism%22&hl=en&as_sdt=2007&as_ylo=1998&as_yhi=2023
131,R Vasilaki,Provincialising IR? Deadlocks and prospects in post-Western IR theory,2012,Millennium,journals.sagepub.com,https://journals.sagepub.com/doi/abs/10.1177/0305829812451720,https://scholar.google.com/scholar?cites=7974814198409657427&as_sdt=2005&sciodt=2007&hl=en,371,1/30/2024 21:21,,10.1177/0305829812451720,,,,,,,131,10.92,131,1,12,… domination targeted by postcolonialism is ultimately hindered … I also argue that the political aspirations of postcolonialism … the convergence of postcolonialism with postsecularism leads. …,,https://scholar.google.com/scholar?q=related:U_zy1UI7rG4J:scholar.google.com/&scioq=postcolonialism%7C%22post+colonialism%22%7Cpostcolonialism%7C%22post+colonialism%22&hl=en&as_sdt=2007&as_ylo=1998&as_yhi=2023
413,RR Ruether,Women and redemption: A theological history,2011,,books.google.com,https://books.google.com/books?hl=en&lr=&id=pEJzuC8VVdEC&oi=fnd&pg=PR11&dq=postcolonialism%7C%22post+colonialism%22%7Cpostcolonialism%7C%22post+colonialism%22&ots=altP3Fo62o&sig=8hCVYRaJe-Zs_ACgps03YCZrqUc,https://scholar.google.com/scholar?cites=5785670756652295807&as_sdt=2005&sciodt=2007&hl=en,372,1/30/2024 21:21,BOOK,,,,,,,,413,31.77,413,1,13,"… the theme of postcolonialism. Postcolonialism is seen as a key category for global society, both for former colonized groups and former colonizers. The “post” in postcolonialism does not …",,https://scholar.google.com/scholar?q=related:fyagPebUSlAJ:scholar.google.com/&scioq=postcolonialism%7C%22post+colonialism%22%7Cpostcolonialism%7C%22post+colonialism%22&hl=en&as_sdt=2007&as_ylo=1998&as_yhi=2023
81,SY Koh,"Race, education, and citizenship: Mobile Malaysians, British colonial legacies, and a culture of migration",2017,,Springer,https://link.springer.com/book/10.1057/978-1-137-50344-2,https://scholar.google.com/scholar?cites=14824641937619544331&as_sdt=2005&sciodt=2007&hl=en,373,1/30/2024 21:21,BOOK,10.1057/978-1-137-50344-2,,,,,,,81,11.57,81,1,7,"Transnational skilled migrants are often thought of as privileged migrants with flexible citizenship. This book challenges this assumption by examining the diverse migration trajectories, …",,https://scholar.google.com/scholar?q=related:C-krRky1u80J:scholar.google.com/&scioq=postcolonialism%7C%22post+colonialism%22%7Cpostcolonialism%7C%22post+colonialism%22&hl=en&as_sdt=2007&as_ylo=1998&as_yhi=2023
0,S Obendorf,Postcolonialism incorporated?,2011,,eprints.lincoln.ac.uk,http://eprints.lincoln.ac.uk/id/eprint/5972/,,374,1/30/2024 21:21,,,,,,,,,0,0,0,1,13,… Yet as postcolonialism has established itself within the … that as well as identifying what postcolonialism doesn’t say (and … The paper also suggests that as scholars of postcolonialism we …,,https://scholar.google.com/scholar?q=related:js96SQVHSTUJ:scholar.google.com/&scioq=postcolonialism%7C%22post+colonialism%22%7Cpostcolonialism%7C%22post+colonialism%22&hl=en&as_sdt=2007&as_ylo=1998&as_yhi=2023
107,S Mezzadra,The Citizen and the Subject: A Post-Colonial Constitution for the European Union?,2020,"Conflict, Power, and the Landscape of …",taylorfrancis.com,https://www.taylorfrancis.com/chapters/edit/10.4324/9780367817701-5/citizen-subject-post-colonial-constitution-european-union-sandro-mezzadra,https://scholar.google.com/scholar?cites=3528616577810370454&as_sdt=2005&sciodt=2007&hl=en,375,1/30/2024 21:21,,10.4324/9780367817701-5,,,,,,,107,26.75,107,1,4,"… in which the end of colonialism came about, post-colonialism denotes a situation in which the ‘meta… It is in the background of such a definition of post-colonialism that I am now turning to …",https://desexil.com/wp-content/uploads/2021/05/MEZZADRA.pdf,https://scholar.google.com/scholar?q=related:lg_xBBUq-DAJ:scholar.google.com/&scioq=postcolonialism%7C%22post+colonialism%22%7Cpostcolonialism%7C%22post+colonialism%22&hl=en&as_sdt=2007&as_ylo=1998&as_yhi=2023
1,T IMADA,"Soundscape, postcolonialism and music education: experiencing the earliest grain of the body and music",2008,Music Education Policy and Implementation …,hirosaki.repo.nii.ac.jp,https://hirosaki.repo.nii.ac.jp/?action=repository_action_common_download&item_id=8&item_no=1&attribute_id=20&file_no=2#page=135,https://scholar.google.com/scholar?cites=14746957280494225575&as_sdt=2005&sciodt=2007&hl=en,376,1/30/2024 21:21,PDF,,,,,,,,1,0.06,1,1,16,"In the late twentieth century, non-Western nations experienced de-colonization and dismantlement of Euro-American imperialism. Postcolonialist thinkers indicate a chaotic state that …",https://hirosaki.repo.nii.ac.jp/?action=repository_action_common_download&item_id=8&item_no=1&attribute_id=20&file_no=2#page=135,https://scholar.google.com/scholar?q=related:pwi4jYO3p8wJ:scholar.google.com/&scioq=postcolonialism%7C%22post+colonialism%22%7Cpostcolonialism%7C%22post+colonialism%22&hl=en&as_sdt=2007&as_ylo=1998&as_yhi=2023
67,S Molloy,Postcolonial Latin America and the Magic Realist Imperative: A Report to an Academy,2005,"Nation, Language, and the Ethics of Translation",books.google.com,https://books.google.com/books?hl=en&lr=&id=Yc8qAAAAQBAJ&oi=fnd&pg=PA370&dq=postcolonialism%7C%22post+colonialism%22%7Cpostcolonialism%7C%22post+colonialism%22&ots=Yd6KpuGvk1&sig=71OQMFurK4VVX9YW42NcnOU3e78,https://scholar.google.com/scholar?cites=16102066139942394751&as_sdt=2005&sciodt=2007&hl=en,377,1/30/2024 21:21,,,,,,,,,67,3.53,67,1,19,"… Furthermore, this is a postcolonialism the nature of which very much depends on its site … postcolonialism that is constituted by shifting perspectives. In other words, it is a postcolonialism …",,https://scholar.google.com/scholar?q=related:f5schdcHdt8J:scholar.google.com/&scioq=postcolonialism%7C%22post+colonialism%22%7Cpostcolonialism%7C%22post+colonialism%22&hl=en&as_sdt=2007&as_ylo=1998&as_yhi=2023
132,D Brydon,Postcolonialism,2006,(No Title),cir.nii.ac.jp,https://cir.nii.ac.jp/crid/1130000796346637056,https://scholar.google.com/scholar?cites=9522663525692698785&as_sdt=2005&sciodt=2007&hl=en,378,1/30/2024 21:21,CITATION,,,,,,,,132,7.33,132,1,18,"Postcolonialism | CiNii Research … タイトル ""Postcolonialism"" … Postcolonialism : critical concepts …",,https://scholar.google.com/scholar?q=related:oXB7_AVMJ4QJ:scholar.google.com/&scioq=postcolonialism%7C%22post+colonialism%22%7Cpostcolonialism%7C%22post+colonialism%22&hl=en&as_sdt=2007&as_ylo=1998&as_yhi=2023
0,"A Tinsley, JE Taneti, J Abraham",Postcolonialism and Religions,,Springer,,https://link.springer.com/content/pdf/10.1057/9781137546364.pdf,,379,1/30/2024 21:21,,10.1057/9781137546364,,,,,,,0,0,0,3,,"The Postcolonialism and Religions series by its very name bridges the secular with the sacred through hybrid, interstitial, and contrapuntal inquiries. The series features the scholarship …",http://ndl.ethernet.edu.et/bitstream/123456789/76556/1/149.pdf.pdf,https://scholar.google.com/scholar?q=related:z8pYRoqwfJEJ:scholar.google.com/&scioq=postcolonialism%7C%22post+colonialism%22%7Cpostcolonialism%7C%22post+colonialism%22&hl=en&as_sdt=2007&as_ylo=1998&as_yhi=2023
176,P Chakravorty,"Bells of change: Kathak dance, women and modernity in India",2008,,works.swarthmore.edu,https://works.swarthmore.edu/fac-dance/31/,https://scholar.google.com/scholar?cites=1901949642928731573&as_sdt=2005&sciodt=2007&hl=en,380,1/30/2024 21:21,,,,,,,,,176,11,176,1,16,"… dance within the discourses of the modern and the global, tracing the arc of two centuries of Kathak: the colonial nautch dance, classical Kathak under nationalism and postcolonialism …",,https://scholar.google.com/scholar?q=related:tbVyjx8VZRoJ:scholar.google.com/&scioq=postcolonialism%7C%22post+colonialism%22%7Cpostcolonialism%7C%22post+colonialism%22&hl=en&as_sdt=2007&as_ylo=1998&as_yhi=2023
0,"N Fediyanto, V Mandarani, Y Astutik",Spaces in Short Stories by Sidoarjo Woman Writers: A Postcolonialism Perspective,2021,ICONESIA 2021,researchgate.net,https://www.researchgate.net/profile/Hasnul-Djohar/publication/358520594_PROCEEDING_OF_ICONESIA_2021/links/6205ed7b7b05f82592e0201b/PROCEEDING-OF-ICONESIA-2021.pdf#page=36,,381,1/30/2024 21:21,PDF,,,,,,,,0,0,0,3,3,… The problem examined in this study is the possible traces of postcolonialism in these texts and how these traces of postcolonialism emerge in space politics. Data were collected …,https://www.researchgate.net/profile/Hasnul-Djohar/publication/358520594_PROCEEDING_OF_ICONESIA_2021/links/6205ed7b7b05f82592e0201b/PROCEEDING-OF-ICONESIA-2021.pdf#page=36,https://scholar.google.com/scholar?q=related:85yZNtj16tsJ:scholar.google.com/&scioq=postcolonialism%7C%22post+colonialism%22%7Cpostcolonialism%7C%22post+colonialism%22&hl=en&as_sdt=2007&as_ylo=1998&as_yhi=2023
57,A Loomba,Situating colonial and postcolonial studies,1998,,academia.edu,https://www.academia.edu/download/59483321/Literary_Theory_-_An_Anthology_Blackwell20190601-94544-fbkrbp.pdf#page=1121,https://scholar.google.com/scholar?cites=18219771944262109455&as_sdt=2005&sciodt=2007&hl=en,382,1/30/2024 21:21,BOOK,,,,,,,,57,2.19,57,1,26,"… As we will see, many writings on postcolonialism emphasise concepts like'hybridity'and fragmentation and diversity, and yet they routinely claim to be describing'the postcolonial …",https://www.academia.edu/download/59483321/Literary_Theory_-_An_Anthology_Blackwell20190601-94544-fbkrbp.pdf#page=1121,https://scholar.google.com/scholar?q=related:DwlfAg2i2fwJ:scholar.google.com/&scioq=postcolonialism%7C%22post+colonialism%22%7Cpostcolonialism%7C%22post+colonialism%22&hl=en&as_sdt=2007&as_ylo=1998&as_yhi=2023
1,MJ Powers,"Sinologism: An Alternative to Orientalism and Postcolonialism. By MING DONG GU. London: Routledge, 2013. xxii, 269 pp. $145.00 (cloth).",2014,The Journal of Asian Studies,cambridge.org,https://www.cambridge.org/core/journals/journal-of-asian-studies/article/sinologism-an-alternative-to-orientalism-and-postcolonialism-by-ming-donggu-london-routledge-2013-xxii-269-pp-14500-cloth/CE36F5D73727946651AA8A49787165E9,https://scholar.google.com/scholar?cites=11488147879689579227&as_sdt=2005&sciodt=2007&hl=en,383,1/30/2024 21:21,,,,,,,,,1,0.1,1,1,10,"As early as the mid-eighteenth century, Francois Quesnay recognized that Western accounts of China often were riddled with bias, and wrote an essay exposing Baron Montesquieu’s …",,https://scholar.google.com/scholar?q=related:2-oNOKEZbp8J:scholar.google.com/&scioq=postcolonialism%7C%22post+colonialism%22%7Cpostcolonialism%7C%22post+colonialism%22&hl=en&as_sdt=2007&as_ylo=1998&as_yhi=2023
0,S Mukherjee,3 Ludonarrative Postcolonialism,2023,Global Perspectives on Digital Literature: A Critical …,books.google.com,https://books.google.com/books?hl=en&lr=&id=aEa8EAAAQBAJ&oi=fnd&pg=RA1-PA1869&dq=postcolonialism%7C%22post+colonialism%22%7Cpostcolonialism%7C%22post+colonialism%22&ots=FBtZUJCJec&sig=5NqzMzb9QeLNtAvgu7x7NmEFKm4,,384,1/30/2024 21:21,,,,,,,,,0,0,0,1,1,"… Postcolonialism have begun featuring regularly in Games Studies. Why did Postcolonialism … -known and current theoretical framework as Postcolonialism is surprising. Admittedly, Lisa …",,https://scholar.google.com/scholar?q=related:q2_2YF0z35UJ:scholar.google.com/&scioq=postcolonialism%7C%22post+colonialism%22%7Cpostcolonialism%7C%22post+colonialism%22&hl=en&as_sdt=2007&as_ylo=1998&as_yhi=2023
0,MI NAYAK,BETWEEN PALMS AND POSTCOLONIALISM,,,,,,385,1/30/2024 21:21,CITATION,,,,,,,,0,0,0,1,,,,https://scholar.google.com/scholar?q=related:whG-HmhdrZUJ:scholar.google.com/&scioq=postcolonialism%7C%22post+colonialism%22%7Cpostcolonialism%7C%22post+colonialism%22&hl=en&as_sdt=2007&as_ylo=1998&as_yhi=2023
3,AKS Piper,Post-Colonialism and the Reinterpretation of New Zealandâ€™ s Colonial Narrative: The Wairua Massacre,2013,Australian Folklore,journals.kvasirpublishing.com,https://journals.kvasirpublishing.com/af/article/view/124,https://scholar.google.com/scholar?cites=4546235043514772242&as_sdt=2005&sciodt=2007&hl=en,386,1/30/2024 21:21,,,,,,,,,3,0.27,3,1,11,"… Post-colonialism has provided the means by which contemporary historians can challenge … New Zealand, this paper demonstrates how post-colonialism enriches and provides a more …",https://journals.kvasirpublishing.com/af/article/download/124/228,https://scholar.google.com/scholar?q=related:EmshYq94Fz8J:scholar.google.com/&scioq=postcolonialism%7C%22post+colonialism%22%7Cpostcolonialism%7C%22post+colonialism%22&hl=en&as_sdt=2007&as_ylo=1998&as_yhi=2023
0,A SHARMA,THE EMERGENCE OF POSTCOLONIALISM: A HISTORICAL ASPECT,,academia.edu,,https://www.academia.edu/download/44322495/7._IJHAMS_-_THE_EMERGENCE_OF_POSTCOLONIALISM_A_HISTORICAL_ASPECT.pdf,,387,1/30/2024 21:21,PDF,,,,,,,,0,0,0,1,,"… This research paper aims to study the emergence of postcolonialism as a new avenue of … , neocolonialism and eventually postcolonialism. The importance of postcolonialism as a tool in …",https://www.academia.edu/download/44322495/7._IJHAMS_-_THE_EMERGENCE_OF_POSTCOLONIALISM_A_HISTORICAL_ASPECT.pdf,https://scholar.google.com/scholar?q=related:o0sioMhOCBIJ:scholar.google.com/&scioq=postcolonialism%7C%22post+colonialism%22%7Cpostcolonialism%7C%22post+colonialism%22&hl=en&as_sdt=2007&as_ylo=1998&as_yhi=2023
2,"L Rui, J Dan, J Dan",Original Paper Analyzing “Other” Construction in Robinson Crusoe from Post Colonialism Perspective,2018,,pdfs.semanticscholar.org,https://pdfs.semanticscholar.org/9bf3/dd2f286fcb60d99383fb5608745be9a2933f.pdf,https://scholar.google.com/scholar?cites=13478393073794112682&as_sdt=2005&sciodt=2007&hl=en,388,1/30/2024 21:21,PDF,,,,,,,,2,0.33,1,3,6,"This paper uses the theory of post-colonialism to do research on “Robinson Crusoe”, taking the geographical environment (the desert island) and nation (Friday and Robinson) as …",https://pdfs.semanticscholar.org/9bf3/dd2f286fcb60d99383fb5608745be9a2933f.pdf,https://scholar.google.com/scholar?q=related:qlyVyhbfDLsJ:scholar.google.com/&scioq=postcolonialism%7C%22post+colonialism%22%7Cpostcolonialism%7C%22post+colonialism%22&hl=en&as_sdt=2007&as_ylo=1998&as_yhi=2023
116,S Gauch,"Liberating Shahrazad: feminism, postcolonialism, and Islam",2007,,africabib.org,https://www.africabib.org/rec.php?RID=294618716,https://scholar.google.com/scholar?cites=2918292412401964954&as_sdt=2005&sciodt=2007&hl=en,389,1/30/2024 21:21,CITATION,,,,,,,,116,6.82,116,1,17,"AfricaBib | Liberating Shahrazad: feminism, postcolonialism, and Islam … Title: Liberating Shahrazad: feminism, postcolonialism, and Islam …",,https://scholar.google.com/scholar?q=related:mtfvv3zbfygJ:scholar.google.com/&scioq=postcolonialism%7C%22post+colonialism%22%7Cpostcolonialism%7C%22post+colonialism%22&hl=en&as_sdt=2007&as_ylo=1998&as_yhi=2023
2,F Rizvi,Chapter 3: Postcolonialism and globalization in education,2009,Counterpoints,JSTOR,https://www.jstor.org/stable/42980380,https://scholar.google.com/scholar?cites=4569934192335158207&as_sdt=2005&sciodt=2007&hl=en,390,1/30/2024 21:21,,,,,,,,,2,0.13,2,1,15,"… , postcolonialism has effectively become a reconciliatory rather than a critical, anticolonialist category. During argues that a more critical postcolonialism … of postcolonialism has been its …",,https://scholar.google.com/scholar?q=related:v3sMde-qaz8J:scholar.google.com/&scioq=postcolonialism%7C%22post+colonialism%22%7Cpostcolonialism%7C%22post+colonialism%22&hl=en&as_sdt=2007&as_ylo=1998&as_yhi=2023
3,A Johnston,Travel Magazines and Settler (Post) Colonialism,2018,The Cambridge Companion to Postcolonial Travel …,researchgate.net,https://www.researchgate.net/profile/Mary-Pratt/publication/322250659_The_Cambridge_Companion_to_Postcolonial_Travel_Writing/links/618721d63068c54fa5b8f0ec/The-Cambridge-Companion-to-Postcolonial-Travel-Writing.pdf#page=211,https://scholar.google.com/scholar?cites=15546977512509442168&as_sdt=2005&sciodt=2007&hl=en,391,1/30/2024 21:21,PDF,,,,,,,,3,0.5,3,1,6,"In early 2016, the Australian Broadcasting Corporation (ABC) online news website featured brilliantly colored photographs of Papua New Guinean men in elaborate tribal costume. 1 …",https://www.researchgate.net/profile/Mary-Pratt/publication/322250659_The_Cambridge_Companion_to_Postcolonial_Travel_Writing/links/618721d63068c54fa5b8f0ec/The-Cambridge-Companion-to-Postcolonial-Travel-Writing.pdf#page=211,https://scholar.google.com/scholar?q=related:eIgcHK31wdcJ:scholar.google.com/&scioq=postcolonialism%7C%22post+colonialism%22%7Cpostcolonialism%7C%22post+colonialism%22&hl=en&as_sdt=2007&as_ylo=1998&as_yhi=2023
434,S Harding,The postcolonial science and technology studies reader,2011,,books.google.com,https://books.google.com/books?hl=en&lr=&id=8j5T1nsv43kC&oi=fnd&pg=PR5&dq=postcolonialism%7C%22post+colonialism%22%7Cpostcolonialism%7C%22post+colonialism%22&ots=Q56ZvHfPEo&sig=tLtRERGdYeUZu4t_CBOT-EQ3WIc,https://scholar.google.com/scholar?cites=7254399069530751105&as_sdt=2005&sciodt=2007&hl=en,392,1/30/2024 21:21,BOOK,,,,,,,,434,33.38,434,1,13,"… colonialism and imperialism and ofwhat the term postcolonialism could mean, require, and … ’s introduction, the institutionalization of postcolonialism in higher education marks “the first …",,https://scholar.google.com/scholar?q=related:gQBOroTNrGQJ:scholar.google.com/&scioq=postcolonialism%7C%22post+colonialism%22%7Cpostcolonialism%7C%22post+colonialism%22&hl=en&as_sdt=2007&as_ylo=1998&as_yhi=2023
418,QL Driskill,Doubleweaving two-spirit critiques: Building alliances between native and queer studies,2010,GLQ: A Journal of Lesbian and Gay Studies,read.dukeupress.edu,https://read.dukeupress.edu/glq/article-abstract/16/1-2/69/34688,https://scholar.google.com/scholar?cites=12772137151859305504&as_sdt=2005&sciodt=2007&hl=en,393,1/30/2024 21:21,,,,,,,,,418,29.86,418,1,14,"… There is also, amongst indigenous academics, the sneaking suspicion that the fashion of post-colonialism has become a strategy for reinscribing or reauthorizing the privileges of non-…",https://www.essaysfisher.com/wp-content/uploads/edd/2022/03/qwo_li_driskill.pdf,https://scholar.google.com/scholar?q=related:IKwk5xG_P7EJ:scholar.google.com/&scioq=postcolonialism%7C%22post+colonialism%22%7Cpostcolonialism%7C%22post+colonialism%22&hl=en&as_sdt=2007&as_ylo=1998&as_yhi=2023
3,J Trombold,"NEO-ROOSEVELT, OR, WHY POST-COLONIALISM IS PREMATURE",2005,interventions,Taylor &Francis,https://www.tandfonline.com/doi/abs/10.1080/13698010500146815,https://scholar.google.com/scholar?cites=8812899607517279328&as_sdt=2005&sciodt=2007&hl=en,394,1/30/2024 21:21,,10.1080/13698010500146815,,,,,,,3,0.16,3,1,19,"Taking up Amy Kaplan's warning about reducing the relations of colonizer and colonized to a single universal model, this article acknowledges the diversity of the colonized, but also …",,https://scholar.google.com/scholar?q=related:YDQ_E4C1TXoJ:scholar.google.com/&scioq=postcolonialism%7C%22post+colonialism%22%7Cpostcolonialism%7C%22post+colonialism%22&hl=en&as_sdt=2007&as_ylo=1998&as_yhi=2023
3,A Chakrabarty,Migrant Identity at the Intersection of Postcolonialism and Modernity,2020,Journal of Migration Affairs,migrationaffairs.com,https://migrationaffairs.com/wp-content/uploads/2020/10/8.-Anindita-Chakrabarty.pdf,https://scholar.google.com/scholar?cites=11164377393447823205&as_sdt=2005&sciodt=2007&hl=en,395,1/30/2024 21:21,PDF,,,,,,,,3,0.75,3,1,4,The post-Partition Indian state has become the place of residence for significant undocumented migrants from erstwhile East Bengal as well as present-day Bangladesh. The presence …,https://migrationaffairs.com/wp-content/uploads/2020/10/8.-Anindita-Chakrabarty.pdf,https://scholar.google.com/scholar?q=related:ZefbghbW75oJ:scholar.google.com/&scioq=postcolonialism%7C%22post+colonialism%22%7Cpostcolonialism%7C%22post+colonialism%22&hl=en&as_sdt=2007&as_ylo=1998&as_yhi=2023
71,L Carter,Postcolonial interventions within science education: Using postcolonial ideas to reconsider cultural diversity scholarship,2006,Educational Philosophy and Theory,Taylor &Francis,https://www.tandfonline.com/doi/abs/10.1111/j.1469-5812.2006.00219.x,https://scholar.google.com/scholar?cites=601128465291861348&as_sdt=2005&sciodt=2007&hl=en,396,1/30/2024 21:21,,10.1111/j.1469-5812.2006.00219.x,,,,,,,71,3.94,71,1,18,"… I begin with a brief overview of postcolonialism that argues its ability to offer theoretical … Finally, I conclude this paper with some general comments regarding postcolonialism and …",,https://scholar.google.com/scholar?q=related:ZN0YfiejVwgJ:scholar.google.com/&scioq=postcolonialism%7C%22post+colonialism%22%7Cpostcolonialism%7C%22post+colonialism%22&hl=en&as_sdt=2007&as_ylo=1998&as_yhi=2023
83,N Kumar,"The politics of gender, community, and modernity: Essays on education",2011,,scholarship.claremont.edu,https://scholarship.claremont.edu/cmc_facbooks/7/,https://scholar.google.com/scholar?cites=4246414370435290187&as_sdt=2005&sciodt=2007&hl=en,397,1/30/2024 21:21,BOOK,,,,,,,,83,6.38,83,1,13,… of history within communities; the second part works towards producing gendered and community-oriented histories of modernity in South Asia; the third part proposes post-colonialism …,,https://scholar.google.com/scholar?q=related:S9ToFl9L7joJ:scholar.google.com/&scioq=postcolonialism%7C%22post+colonialism%22%7Cpostcolonialism%7C%22post+colonialism%22&hl=en&as_sdt=2007&as_ylo=1998&as_yhi=2023
47,HA Giroux,The Politics of National Identity and the Pedagogy of Multiculturalism in the USA 1,2013,Multicultural States,taylorfrancis.com,https://www.taylorfrancis.com/chapters/edit/10.4324/9780203007549-14/politics-national-identity-pedagogy-multiculturalism-usa-1-henry-giroux,https://scholar.google.com/scholar?cites=9252419113265473506&as_sdt=2005&sciodt=2007&hl=en,398,1/30/2024 21:21,,10.4324/9780203007549-14/politics-national-identity-pedagogy-multiculturalism-usa-1-henry-giroux,,,,,,,47,4.27,47,1,11,"… , identity politics, multiculturalism and postcolonialism, are as profound intellectually as they … globalisation, diaspora, multiculturalism and postcolonialism. 3 I am particularly concerned …",,https://scholar.google.com/scholar?q=related:4ic5fykyZ4AJ:scholar.google.com/&scioq=postcolonialism%7C%22post+colonialism%22%7Cpostcolonialism%7C%22post+colonialism%22&hl=en&as_sdt=2007&as_ylo=1998&as_yhi=2023
3,JL Uytanlet,Pride and Prejudice: Colonialism and Post-Colonialism in the Philippine Chinese Context: How IBS Can Be a Liberating Methodology to Find the Truth to Be Set Free,2013,The Asbury Journal,place.asburyseminary.edu,https://place.asburyseminary.edu/asburyjournal/vol68/iss1/6/,https://scholar.google.com/scholar?cites=3133931948221830796&as_sdt=2005&sciodt=2007&hl=en,399,1/30/2024 21:21,,,,,,,,,3,0.27,3,1,11,This paper aims to present the importance of disentangling the Philippine Chinese from a colonial mindset before they can truly be disentangled from their wrong beliefs and practices. It …,https://place.asburyseminary.edu/cgi/viewcontent.cgi?article=1185&context=asburyjournal,https://scholar.google.com/scholar?q=related:jJYCrID2fSsJ:scholar.google.com/&scioq=postcolonialism%7C%22post+colonialism%22%7Cpostcolonialism%7C%22post+colonialism%22&hl=en&as_sdt=2007&as_ylo=1998&as_yhi=2023
