Cites,Authors,Title,Year,Source,Publisher,ArticleURL,CitesURL,GSRank,QueryDate,Type,DOI,ISSN,CitationURL,Volume,Issue,StartPage,EndPage,ECC,CitesPerYear,CitesPerAuthor,AuthorCount,Age,Abstract,FullTextURL,RelatedURL
384,"KL Nadal, KC Davidoff, LS Davis, Y Wong…","A qualitative approach to intersectional microaggressions: Understanding influences of race, ethnicity, gender, sexuality, and religion.",2015,"Qualitative …","psycnet.apa.org","https://psycnet.apa.org/record/2015-30580-001","https://scholar.google.com/scholar?cites=6716942059140746835&as_sdt=2005&sciodt=2007&hl=en",356,"2024-01-30 22:10:58","","","","",,,,,384,42.67,77,5,9,"… of oppression (eg, racism, sexism, … oppressed groups (eg, people of color, LGBT people, etc.) will identify intersectional microaggressions that are embedded in systemic oppression…","https://www.researchgate.net/profile/Kevin-Nadal/publication/311627782_Intersectional_identities_and_microaggressions_Influences_of_race_ethnicity_gender_sexuality_and_religion/links/605dcf44a6fdccbfea0b168c/Intersectional-identities-and-microaggressions-Influences-of-race-ethnicity-gender-sexuality-and-religion.pdf","https://scholar.google.com/scholar?q=related:Uw73AzdfN10J:scholar.google.com/&scioq=systemic+racism%7Csystemic+oppression&hl=en&as_sdt=2007&as_ylo=1998&as_yhi=2023"
148,"R Almeida, J Lockard","The cultural context model",2005,"… violence at the margins: Readings in race …","books.google.com","https://books.google.com/books?hl=en&lr=&id=SANRgrmzSYAC&oi=fnd&pg=PA301&dq=systemic+racism%7Csystemic+oppression&ots=Up_U9BxvBL&sig=Y5wXFm0CGTgqVMaouCo8uLgnNT4","https://scholar.google.com/scholar?cites=17977849164637956134&as_sdt=2005&sciodt=2007&hl=en",357,"2024-01-30 22:10:58","","","","",,,,,148,7.79,74,2,19,"… and perpetuate racism and sexism and the ways those forms of oppression are manifest in … systemic analysis. The CulturalContext Modelexpandsthe concepts of power and oppression, …","","https://scholar.google.com/scholar?q=related:JmjMg5AmfvkJ:scholar.google.com/&scioq=systemic+racism%7Csystemic+oppression&hl=en&as_sdt=2007&as_ylo=1998&as_yhi=2023"
1012,"AL Pieterse, NR Todd, HA Neville…","Perceived racism and mental health among Black American adults: a meta-analytic review.",2012,"Journal of counseling …","psycnet.apa.org","https://psycnet.apa.org/journals/cou/59/1/1/","https://scholar.google.com/scholar?cites=7819322208546127969&as_sdt=2005&sciodt=2007&hl=en",358,"2024-01-30 22:10:58","","","","",,,,,1012,84.33,253,4,12,"… in the systematic review. Our … racism, racial discrimination, ethnic discrimination, racist, Black, African American, racial trauma, racial oppression, racial harassment, and perceived racism…","https://www.ebony.com/wp-content/uploads/2013/02/cou-59-1-1.pdf","https://scholar.google.com/scholar?q=related:YQC3wB7Qg2wJ:scholar.google.com/&scioq=systemic+racism%7Csystemic+oppression&hl=en&as_sdt=2007&as_ylo=1998&as_yhi=2023"
4,"K Munroe-Anderson","Set our spirits free: Exploring the role of spirituality as an anti-oppressive agent in the formal education of African Nova Scotian learners",2018,"","ec.msvu.ca","https://ec.msvu.ca/bitstreams/43f5929e-6b3c-4ebe-976f-1964ca03c9f3/download","https://scholar.google.com/scholar?cites=5339259119003694686&as_sdt=2005&sciodt=2007&hl=en",359,"2024-01-30 22:10:58","PDF","","","",,,,,4,0.67,4,1,6,"… However, numerous researchers concur that systemic racism in Canadian society - linked … Various manifestations of systemic racism present in Canadian public-school systems have …","https://ec.msvu.ca/bitstreams/43f5929e-6b3c-4ebe-976f-1964ca03c9f3/download","https://scholar.google.com/scholar?q=related:Xvb6T-HbGEoJ:scholar.google.com/&scioq=systemic+racism%7Csystemic+oppression&hl=en&as_sdt=2007&as_ylo=1998&as_yhi=2023"
184,"E Alemán, Jr, SM Alemán","'Do Latin@ interests always have to “converge” with White interests?':(Re) claiming racial realism and interest‐convergence in critical race theory praxis",2010,"Race Ethnicity and Education","Taylor &Francis","https://www.tandfonline.com/doi/abs/10.1080/13613320903549644","https://scholar.google.com/scholar?cites=3360900804441969091&as_sdt=2005&sciodt=2007&hl=en",360,"2024-01-30 22:10:58","","10.1080/13613320903549644","","",,,,,184,13.14,61,3,14,"… on the individual rather than on the institutional or systemic racism that exists. Each of these … that the racism at the heart of disenfranchisement and oppression is rooted in systemic and …","","https://scholar.google.com/scholar?q=related:w5EWjnlRpC4J:scholar.google.com/&scioq=systemic+racism%7Csystemic+oppression&hl=en&as_sdt=2007&as_ylo=1998&as_yhi=2023"
150,"AG Johnson","Patriarchy, the system",2004,"Women's lives: Multicultural perspectives","womrel.sitehost.iu.edu","https://womrel.sitehost.iu.edu/Rel%20101_Religion&Culture/Johnson_Patriarchy.pdf","https://scholar.google.com/scholar?cites=1541225114202400941&as_sdt=2005&sciodt=2007&hl=en",361,"2024-01-30 22:10:58","PDF","","","",,,,,150,7.50,150,1,20,"… If a society is oppressive, then people who grow up and live … for an oppressive system to produce oppressive consequences… though dynamics such as racism and class oppression don't …","https://womrel.sitehost.iu.edu/Rel%20101_Religion&Culture/Johnson_Patriarchy.pdf","https://scholar.google.com/scholar?q=related:rejxWhOIYxUJ:scholar.google.com/&scioq=systemic+racism%7Csystemic+oppression&hl=en&as_sdt=2007&as_ylo=1998&as_yhi=2023"
410,"EJR David, S Okazaki","Colonial mentality: a review and recommendation for Filipino American psychology.",2006,"Cultural Diversity and Ethnic Minority …","psycnet.apa.org","https://psycnet.apa.org/journals/cdp/12/1/1/","https://scholar.google.com/scholar?cites=6200272863936183209&as_sdt=2005&sciodt=2007&hl=en",362,"2024-01-30 22:10:58","","","","",,,,,410,22.78,205,2,18,"… racism, sexism, homophobia, and other forms of oppression… , internalized oppression, a condition in which the oppressed … salient consequence of systematic and sustained oppression. …","https://citeseerx.ist.psu.edu/document?repid=rep1&type=pdf&doi=deb948f0fda862a367d6e94fa8ecc92447fd615a","https://scholar.google.com/scholar?q=related:qftovVHLC1YJ:scholar.google.com/&scioq=systemic+racism%7Csystemic+oppression&hl=en&as_sdt=2007&as_ylo=1998&as_yhi=2023"
355,"R Walton, K Moore, N Jones","Technical communication after the social justice turn: Building coalitions for action",2019,"","books.google.com","https://books.google.com/books?hl=en&lr=&id=1uuYDwAAQBAJ&oi=fnd&pg=PT11&dq=systemic+racism%7Csystemic+oppression&ots=ZQBJ6cWz26&sig=X14GqDMeUyn8Q25_W2AfecYZsdg","https://scholar.google.com/scholar?cites=16040185178950478855&as_sdt=2005&sciodt=2007&hl=en",363,"2024-01-30 22:10:58","BOOK","","","",,,,,355,71.00,118,3,5,"… oppression, but to enact social justice as technical communicators, first, we must be able to trace daily practice to the oppressive … accounting for racism (or any other form of oppression, …","https://cptsc.org/wp-content/uploads/2021/12/Issue-12.1.pdf#page=157","https://scholar.google.com/scholar?q=related:ByzUim8vmt4J:scholar.google.com/&scioq=systemic+racism%7Csystemic+oppression&hl=en&as_sdt=2007&as_ylo=1998&as_yhi=2023"
4458,"R Clark, NB Anderson, VR Clark…","Racism as a stressor for African Americans: A biopsychosocial model.",1999,"American …","psycnet.apa.org","https://psycnet.apa.org/record/1999-11644-001","https://scholar.google.com/scholar?cites=10519856402796598471&as_sdt=2005&sciodt=2007&hl=en",364,"2024-01-30 22:10:58","","","","",,,,,4458,178.32,1115,4,25,"… racism, and (c) to present a conceptual model for systematic … racism as a relationship between members of oppressed … more comprehensive definition of racism encompasses beliefs, …","https://www.academia.edu/download/66031748/632bec7fd9cf8a741452db6ecb6bc3f0c391.pdf","https://scholar.google.com/scholar?q=related:x1TPaKkJ_pEJ:scholar.google.com/&scioq=systemic+racism%7Csystemic+oppression&hl=en&as_sdt=2007&as_ylo=1998&as_yhi=2023"
215,"D Francis, T Msibi","Teaching about heterosexism: Challenging homophobia in South Africa",2011,"Journal of LGBT Youth","Taylor &Francis","https://www.tandfonline.com/doi/abs/10.1080/19361653.2011.553713","https://scholar.google.com/scholar?cites=13626072374585869700&as_sdt=2005&sciodt=2007&hl=en",365,"2024-01-30 22:10:58","","10.1080/19361653.2011.553713","","",,,,,215,16.54,108,2,13,"… and systemic. Thirdly, psychological colonization of the target group occurs through socializing the oppressed to internalize their oppressed … racism and sexism as forms of oppression in …","https://www.researchgate.net/profile/Dennis-Francis-2/publication/232961423_Teaching_About_Heterosexism_Challenging_Homophobia_in_South_Africa/links/568ef6d908aead3f42f07c55/Teaching-About-Heterosexism-Challenging-Homophobia-in-South-Africa.pdf","https://scholar.google.com/scholar?q=related:hEX0cqGIGb0J:scholar.google.com/&scioq=systemic+racism%7Csystemic+oppression&hl=en&as_sdt=2007&as_ylo=1998&as_yhi=2023"
358,"D Nibert","Animal oppression and human violence: Domesecration, capitalism, and global conflict",2013,"","books.google.com","https://books.google.com/books?hl=en&lr=&id=GsOrAgAAQBAJ&oi=fnd&pg=PA1&dq=systemic+racism%7Csystemic+oppression&ots=xOG8DDgQB6&sig=TuB4aJc-dLJJQuTmSXJEdy5cZrc","https://scholar.google.com/scholar?cites=11854340224380417068&as_sdt=2005&sciodt=2007&hl=en",366,"2024-01-30 22:10:58","BOOK","","","",,,,,358,32.55,358,1,11,"… While much of their treatment unquestionably was in the form of direct physical violence, the animals’ systemic enslavement and oppression also resulted in their inability to meet their …","http://kathrynagillespie.com/wp-content/uploads/2020/01/Gillespie_Animal-Oppression-Human-Violence-Domesecration-Capitalism-and-Global-Conflict.pdf","https://scholar.google.com/scholar?q=related:LLTRiKATg6QJ:scholar.google.com/&scioq=systemic+racism%7Csystemic+oppression&hl=en&as_sdt=2007&as_ylo=1998&as_yhi=2023"
139,"AS Abdullah","Mammy-ism: A diagnosis of psychological misorientation for women of African descent",1998,"Journal of Black Psychology","journals.sagepub.com","https://journals.sagepub.com/doi/abs/10.1177/00957984980242009","https://scholar.google.com/scholar?cites=4777209646163039561&as_sdt=2005&sciodt=2007&hl=en",367,"2024-01-30 22:10:58","","10.1177/00957984980242009","","",,,,,139,5.35,139,1,26,"… defined and ascribed roles dictated by individual and institutionalized racism, roles that help to maintain the dependency and oppression of Black women. One such role ascribed to a …","","https://scholar.google.com/scholar?q=related:SRUeydwOTEIJ:scholar.google.com/&scioq=systemic+racism%7Csystemic+oppression&hl=en&as_sdt=2007&as_ylo=1998&as_yhi=2023"
256,"KT Gines","Hannah Arendt and the negro question",2014,"","books.google.com","https://books.google.com/books?hl=en&lr=&id=x5UxAwAAQBAJ&oi=fnd&pg=PP1&dq=systemic+racism%7Csystemic+oppression&ots=demX6n0TfJ&sig=jEMAsDbS6w9L8vOQf4ANH6z5Fwg","https://scholar.google.com/scholar?cites=13140497847177182293&as_sdt=2005&sciodt=2007&hl=en",368,"2024-01-30 22:10:58","BOOK","","","",,,,,256,25.60,256,1,10,"… oppression more generally, and the means available to identify, confront, and overcome that oppression… Black students, not with the systematic racism in higher education against which …","","https://scholar.google.com/scholar?q=related:VfzHsCttXLYJ:scholar.google.com/&scioq=systemic+racism%7Csystemic+oppression&hl=en&as_sdt=2007&as_ylo=1998&as_yhi=2023"
1279,"KK Kumashiro","Troubling education: Queer activism and antioppressive pedagogy",2002,"","books.google.com","https://books.google.com/books?hl=en&lr=&id=aouDWdkA_b0C&oi=fnd&pg=PP11&dq=systemic+racism%7Csystemic+oppression&ots=K13QtJyYvj&sig=76WZJJl-oeZWKslkeZp6ML-_SMM","https://scholar.google.com/scholar?cites=7016158624704732456&as_sdt=2005&sciodt=2007&hl=en",369,"2024-01-30 22:10:58","BOOK","","","",,,,,1279,58.14,1279,1,22,"… racism, classism, and sexism, which were the other forms of … I focus on queers and their oppression because queers … assisting in the maintenance of systemic racism). They have also …","","https://scholar.google.com/scholar?q=related:KJ1RkRhnXmEJ:scholar.google.com/&scioq=systemic+racism%7Csystemic+oppression&hl=en&as_sdt=2007&as_ylo=1998&as_yhi=2023"
424,"LM Bogart, BO Ojikutu, K Tyagi, DJ Klein…","COVID-19 related medical mistrust, health impacts, and potential vaccine hesitancy among Black Americans living with HIV",2021,"Journal of acquired …","ncbi.nlm.nih.gov","https://www.ncbi.nlm.nih.gov/pmc/articles/PMC7808278/","https://scholar.google.com/scholar?cites=6508486550015576464&as_sdt=2005&sciodt=2007&hl=en",370,"2024-01-30 22:10:58","HTML","","","",,,,,424,141.33,85,5,3,"… Mistrust, which originates in systemic racism, is a rational coping response to centuries of oppression, … and address racism at the national level as a starting point to addressing mistrust. …","https://www.ncbi.nlm.nih.gov/pmc/articles/PMC7808278/","https://scholar.google.com/scholar?q=related:kAkWpwjKUloJ:scholar.google.com/&scioq=systemic+racism%7Csystemic+oppression&hl=en&as_sdt=2007&as_ylo=1998&as_yhi=2023"
278,"T Shelby","Ideology, racism, and critical social theory",2003,"The philosophical forum","tommieshelby.com","http://www.tommieshelby.com/uploads/4/5/1/0/45107805/ideology_and_racism.pdf","https://scholar.google.com/scholar?cites=15253491814493173819&as_sdt=2005&sciodt=2007&hl=en",371,"2024-01-30 22:10:58","PDF","","","",,,,,278,13.24,278,1,21,"… oppression that are characteristic of the modern world. In an effort to defend the continuing relevance of ideology-critique, I shall offer a systematic … reinforce structures of oppression, we …","http://www.tommieshelby.com/uploads/4/5/1/0/45107805/ideology_and_racism.pdf","https://scholar.google.com/scholar?q=related:O7gxI_1Jr9MJ:scholar.google.com/&scioq=systemic+racism%7Csystemic+oppression&hl=en&as_sdt=2007&as_ylo=1998&as_yhi=2023"
302,"L Evans, WL Moore","Impossible burdens: White institutions, emotional labor, and micro-resistance",2015,"Social Problems","academic.oup.com","https://academic.oup.com/socpro/article-abstract/62/3/439/1637635","https://scholar.google.com/scholar?cites=3513811278616983047&as_sdt=2005&sciodt=2007&hl=en",372,"2024-01-30 22:10:58","","","","",,,,,302,33.56,151,2,9,"… deny the relevance of race and racism. As a result they must … the pain of experiencing racial oppression, as well as the … suggest that in relationship to systemic white domination, many …","https://academic.oup.com/socpro/article-pdf/62/3/439/5295380/spv009.pdf","https://scholar.google.com/scholar?q=related:B_a5rb2QwzAJ:scholar.google.com/&scioq=systemic+racism%7Csystemic+oppression&hl=en&as_sdt=2007&as_ylo=1998&as_yhi=2023"
1104,"DJ Goodman","Promoting diversity and social justice: Educating people from privileged groups",2011,"","books.google.com","https://books.google.com/books?hl=en&lr=&id=CvKsAgAAQBAJ&oi=fnd&pg=PP1&dq=systemic+racism%7Csystemic+oppression&ots=Eh8YSXS-ks&sig=yO34IZptEjPffKHT-zJ4qKfyh0U","https://scholar.google.com/scholar?cites=9873529106110295034&as_sdt=2005&sciodt=2007&hl=en",373,"2024-01-30 22:10:58","BOOK","","","",,,,,1104,84.92,1104,1,13,"… from unlearning privilege/ oppression and from creating greater … the systematic unfair treatment of people from oppressed … (For men facing other forms of oppression—racism, classism, …","","https://scholar.google.com/scholar?q=related:-isv6WjSBYkJ:scholar.google.com/&scioq=systemic+racism%7Csystemic+oppression&hl=en&as_sdt=2007&as_ylo=1998&as_yhi=2023"
222,"J Grue","Discourse analysis and disability: Some topics and issues",2011,"Discourse &Society","journals.sagepub.com","https://journals.sagepub.com/doi/abs/10.1177/0957926511405572","https://scholar.google.com/scholar?cites=2425267895904047458&as_sdt=2005&sciodt=2007&hl=en",374,"2024-01-30 22:10:58","","10.1177/0957926511405572","","",,,,,222,17.08,222,1,13,"… as a distinct pattern of oppression, discrimination and stigma. … discourse research, such as racism and gender. While disability … systemic oppression are apt for analysis of many political …","https://www.academia.edu/download/35023465/Discourse_Analysis_and_Disability_-_Some_Topics_and_Issues.pdf","https://scholar.google.com/scholar?q=related:YhGFPE1IqCEJ:scholar.google.com/&scioq=systemic+racism%7Csystemic+oppression&hl=en&as_sdt=2007&as_ylo=1998&as_yhi=2023"
290,"C Wun","Unaccounted foundations: Black girls, anti-Black racism, and punishment in schools",2016,"Critical Sociology","journals.sagepub.com","https://journals.sagepub.com/doi/abs/10.1177/0896920514560444","https://scholar.google.com/scholar?cites=15212111754364599801&as_sdt=2005&sciodt=2007&hl=en",375,"2024-01-30 22:10:58","","10.1177/0896920514560444","","",,,,,290,36.25,290,1,8,"… racism is not limited to particular time periods or projects, he argues that anti-black racism is systemic… Sexton, anti-black racism is not limited to white on black racial oppression, but also …","https://www.academia.edu/download/44045090/Black-Girls-Anti-Black-Racism-and-Punishment-in-Schools.Wun_.pdf","https://scholar.google.com/scholar?q=related:-T1yGgtHHNMJ:scholar.google.com/&scioq=systemic+racism%7Csystemic+oppression&hl=en&as_sdt=2007&as_ylo=1998&as_yhi=2023"
410,"DR Means, KB Pyne","Finding my way: Perceptions of institutional support and belonging in low-income, first-generation, first-year college students",2017,"Journal of College Student Development","muse.jhu.edu","https://muse.jhu.edu/pub/1/article/670090/summary","https://scholar.google.com/scholar?cites=1572744804524816633&as_sdt=2005&sciodt=2007&hl=en",376,"2024-01-30 22:10:58","","","","",,,,,410,58.57,205,2,7,"… and their systemic oppression, such as classism, racism, and … Students in this study discussed challenges related to racism … of their social identities or oppression. This may be the case …","","https://scholar.google.com/scholar?q=related:-fgKJBGD0xUJ:scholar.google.com/&scioq=systemic+racism%7Csystemic+oppression&hl=en&as_sdt=2007&as_ylo=1998&as_yhi=2023"
203,"CN Fiani, HJ Han","Navigating identity: Experiences of binary and non-binary transgender and gender non-conforming (TGNC) adults",2020,"Non-binary and Genderqueer Genders","taylorfrancis.com","https://www.taylorfrancis.com/chapters/edit/10.4324/9781003015888-7/navigating-identity-experiences-binary-non-binary-transgender-gender-non-conforming-tgnc-adults-chassitty-fiani-heather-han","https://scholar.google.com/scholar?cites=12609931583085253230&as_sdt=2005&sciodt=2007&hl=en",377,"2024-01-30 22:10:58","","10.4324/9781003015888-7","","",,,,,203,50.75,102,2,4,"… systemic oppression of TGNC populations overall. Fortunately, socio-political tides can change, and increasing visibility of TGNC identities, experiences, perspectives, and needs in the …","https://www.ncbi.nlm.nih.gov/pmc/articles/PMC6830994/","https://scholar.google.com/scholar?q=related:bpLG6_Z5_64J:scholar.google.com/&scioq=systemic+racism%7Csystemic+oppression&hl=en&as_sdt=2007&as_ylo=1998&as_yhi=2023"
155,"A Calhoun-Brown","Upon this rock: The black church, nonviolence, and the civil rights movement",2000,"PS: Political Science &Politics","cambridge.org","https://www.cambridge.org/core/journals/ps-political-science-and-politics/article/upon-this-rock-the-black-church-nonviolence-and-the-civil-rights-movement/E571A993245C89328751AAA8FB494EEF","https://scholar.google.com/scholar?cites=11223426544650793405&as_sdt=2005&sciodt=2007&hl=en",378,"2024-01-30 22:10:58","","","","",,,,,155,6.46,155,1,24,"… themselves to the principal institutions of oppression and racism in the country— white churches. … , people could simultaneously challenge systematic injustice and racism and still …","https://citeseerx.ist.psu.edu/document?repid=rep1&type=pdf&doi=5e90772fd325cb0ac00d46732151e6d0aa9ab5fc","https://scholar.google.com/scholar?q=related:vbGZZPqewZsJ:scholar.google.com/&scioq=systemic+racism%7Csystemic+oppression&hl=en&as_sdt=2007&as_ylo=1998&as_yhi=2023"
307,"D Hook","A critical psychology of the postcolonial: The mind of apartheid",2012,"","books.google.com","https://books.google.com/books?hl=en&lr=&id=RN_FBQAAQBAJ&oi=fnd&pg=PT7&dq=systemic+racism%7Csystemic+oppression&ots=WeLGgfmjXi&sig=LrYLlQHYU6Pq9iuKSDmqkwOHMQM","https://scholar.google.com/scholar?cites=5005330342519001029&as_sdt=2005&sciodt=2007&hl=en",379,"2024-01-30 22:10:58","BOOK","","","",,,,,307,25.58,307,1,12,"… the theorization of racism and oppression. … oppression and the brutality of its devices had, for Biko, exercised an undue influence on the parameters of black subjectivity. The systematic …","https://openjournals.bsu.edu/jsacp/article/download/117/99/","https://scholar.google.com/scholar?q=related:xU9UWW2BdkUJ:scholar.google.com/&scioq=systemic+racism%7Csystemic+oppression&hl=en&as_sdt=2007&as_ylo=1998&as_yhi=2023"
26,"MKL Poon","The discourse of oppression in contemporary gay Asian diasporal literature: Liberation or limitation?",2006,"Sexuality and Culture","Springer","https://link.springer.com/article/10.1007/s12119-006-1019-z","https://scholar.google.com/scholar?cites=664093788030937699&as_sdt=2005&sciodt=2007&hl=en",380,"2024-01-30 22:10:58","","10.1007/s12119-006-1019-z","","",,,,,26,1.44,26,1,18,"… Like Frye, Anne Bishop treats oppression as a systematic … , and the oppression that occurs as a result of the racism that … , reflect a more general racism within the society in general. For …","","https://scholar.google.com/scholar?q=related:Y6ogHchVNwkJ:scholar.google.com/&scioq=systemic+racism%7Csystemic+oppression&hl=en&as_sdt=2007&as_ylo=1998&as_yhi=2023"
7506,"DW Sue, D Sue, HA Neville, L Smith","Counseling the culturally diverse: Theory and practice",2022,"","books.google.com","https://books.google.com/books?hl=en&lr=&id=w8R6EAAAQBAJ&oi=fnd&pg=PA19&dq=systemic+racism%7Csystemic+oppression&ots=WKHv7PSQuH&sig=uo76KT2V3uonweYIcB-h6wMll18","https://scholar.google.com/scholar?cites=11461647043563215055&as_sdt=2005&sciodt=2007&hl=en",381,"2024-01-30 22:10:58","BOOK","","","",,,,,7506,3753.00,1877,4,2,"… Further, the COVID- 19 pandemic has laid bare the existence of systemic racism, and while it … biases of the mental health profession, and to change systems of oppression in our society. …","https://ghnet.guelphhumber.ca/files/course_outlines/FCSS%203040_Mark_Macdonald.approved.pdf","https://scholar.google.com/scholar?q=related:z9h9fELzD58J:scholar.google.com/&scioq=systemic+racism%7Csystemic+oppression&hl=en&as_sdt=2007&as_ylo=1998&as_yhi=2023"
889,"D Lum","Culturally competent practice",2013,"Encyclopedia of social work","oxfordre.com","https://oxfordre.com/socialwork/display/10.1093/acrefore/9780199975839.001.0001/acrefore-9780199975839-e-98","https://scholar.google.com/scholar?cites=11806011023487287243&as_sdt=2005&sciodt=2007&hl=en",382,"2024-01-30 22:10:58","","10.1093/acrefore/9780199975839.001.0001/acrefore-9780199975839-e-98","","",,,,,889,80.82,889,1,11,"… of racism, sexism, homophobia, discrimination, and oppression. The term context implies the “joining and weaving together” of textures that are surrounding or immediately next to parts …","","https://scholar.google.com/scholar?q=related:yz9OlXlg16MJ:scholar.google.com/&scioq=systemic+racism%7Csystemic+oppression&hl=en&as_sdt=2007&as_ylo=1998&as_yhi=2023"
1446,"MJ Ratts, AA Singh, S Nassar‐McMillan…","Multicultural and social justice counseling competencies: Guidelines for the counseling profession",2016,"Journal of …","Wiley Online Library","https://onlinelibrary.wiley.com/doi/abs/10.1002/jmcd.12035","https://scholar.google.com/scholar?cites=15448886477265692828&as_sdt=2005&sciodt=2007&hl=en",383,"2024-01-30 22:10:58","","10.1002/jmcd.12035","","",,,,,1446,180.75,362,4,8,"… inevitably discussing issues of oppression. Oppression exists in the form of racism, sexism, … are those who are oppressed in society and lack the systemic advantages bestowed on …","https://www.researchgate.net/profile/Manivong-Ratts/publication/289244662_Multicultural_and_Social_Justice_Counseling_Competencies_Guidelines_for_the_Counseling_Profession/links/5b63646a0f7e9b00b2a23e9c/Multicultural-and-Social-Justice-Counseling-Competencies-Guidelines-for-the-Counseling-Profession.pdf","https://scholar.google.com/scholar?q=related:nOjBPGZ4ZdYJ:scholar.google.com/&scioq=systemic+racism%7Csystemic+oppression&hl=en&as_sdt=2007&as_ylo=1998&as_yhi=2023"
89,"K Križ, M Skivenes","'Knowing our society'and 'fighting against prejudices': How child welfare workers in Norway and England perceive the challenges of minority parents",2010,"British Journal of Social Work","academic.oup.com","https://academic.oup.com/bjsw/article-abstract/40/8/2634/1663548","https://scholar.google.com/scholar?cites=16233726636704147262&as_sdt=2005&sciodt=2007&hl=en",384,"2024-01-30 22:10:58","","","","",,,,,89,6.36,45,2,14,"… We call this viewpoint systemic, because it focuses on the … was child-focused but relatively oppression and racism-blind. Workers … understanding of racism, structural oppression and the …","","https://scholar.google.com/scholar?q=related:PieMuV3ISeEJ:scholar.google.com/&scioq=systemic+racism%7Csystemic+oppression&hl=en&as_sdt=2007&as_ylo=1998&as_yhi=2023"
